"level";"id";"parent_id";"object_id";"object_type";"object_key";"query_status";"query_time";"query_type";"name";"message"
"1";"1721";"3";"684474272317288";"data";"data.*";"fetched (200)";"2023-10-05 20:52:59.632853";"Facebook:/<comment-id>/comments";"";"Oscar Barrios"
"1";"1722";"3";"684474272317288";"data";"data.*";"fetched (200)";"2023-10-05 20:52:59.632853";"Facebook:/<comment-id>/comments";"";"Está bueno pero creo que el mío no se queda atrás saludos brother"
"1";"1723";"3";"684474272317288";"data";"data.*";"fetched (200)";"2023-10-05 20:52:59.632853";"Facebook:/<comment-id>/comments";"";"Me encantó lo sencillo y práctico que  eres en la cocina, no te complicas y lo haces con mucho gusto, se ve buenazo el chaufa y claro que falto la cebollita china pero como dices se te acabó, pero no te complicas y sigues 👍 Te felicito Christian y estaré atenta para la siguiente clase 👍👍😋😋😋😋👏👏👏😘"
"1";"1724";"3";"684474272317288";"data";"data.*";"fetched (200)";"2023-10-05 20:52:59.632853";"Facebook:/<comment-id>/comments";"";"No seas chistoso pue...un lomo saltado sin cebolla o sin tomate ya no es lomo...igual un chaufa sin su chinita ya no es chaufa... será arroz frito con pollo en trozos y salsas chinas o que se yoo...pero esta buena la idea para esta cuarentena..👍"
"1";"1725";"3";"684474272317288";"data";"data.*";"fetched (200)";"2023-10-05 20:52:59.632853";"Facebook:/<comment-id>/comments";"";"Buena Cristian  con el platillo y sigues con esa chispa que te caracteriza"
"1";"1726";"3";"684474272317288";"data";"data.*";"fetched (200)";"2023-10-05 20:52:59.632853";"Facebook:/<comment-id>/comments";"";"Muy bueno, la cebolla china hubiera sido mejor, y chaufa sin ajinimoto no es chaufa, bien Bravo ! (aceite de oliva grrrrr...)😀"
"1";"1727";"3";"684474272317288";"data";"data.*";"fetched (200)";"2023-10-05 20:52:59.632853";"Facebook:/<comment-id>/comments";"";"Noooooo usas el quinto elemento. Nooooo"
"1";"1728";"3";"684474272317288";"data";"data.*";"fetched (200)";"2023-10-05 20:52:59.632853";"Facebook:/<comment-id>/comments";"";"Bien Christian Bravo saludos"
"1";"1729";"3";"684474272317288";"data";"data.*";"fetched (200)";"2023-10-05 20:52:59.632853";"Facebook:/<comment-id>/comments";"";"Chaufa sin cebolla china?"
"1";"1730";"3";"684474272317288";"data";"data.*";"fetched (200)";"2023-10-05 20:52:59.632853";"Facebook:/<comment-id>/comments";"";"Muy bueno y nutritivo"
"1";"1731";"3";"684474272317288";"offcut";"";"fetched (200)";"2023-10-05 20:52:59.632853";"Facebook:/<comment-id>/comments";"";""
"1";"1732";"4";"589875958273984";"data";"data.*";"fetched (200)";"2023-10-05 20:53:00.331651";"Facebook:/<comment-id>/comments";"";"Tan lindooooo 😘😘😘😘 siempre con su buena vibra. Mi bravito 😜"
"1";"1733";"4";"589875958273984";"data";"data.*";"fetched (200)";"2023-10-05 20:53:00.331651";"Facebook:/<comment-id>/comments";"";"👍👏👏👏una receta diaria no??"
"1";"1734";"4";"589875958273984";"data";"data.*";"fetched (200)";"2023-10-05 20:53:00.331651";"Facebook:/<comment-id>/comments";"";"Danos recetas rápidas. Y gracias por compartir "
"1";"1735";"4";"589875958273984";"data";"data.*";"fetched (200)";"2023-10-05 20:53:00.331651";"Facebook:/<comment-id>/comments";"";"Renzo prepara 👍🏼"
"1";"1736";"4";"589875958273984";"data";"data.*";"fetched (200)";"2023-10-05 20:53:00.331651";"Facebook:/<comment-id>/comments";"";"Felicidades por compartir este video. Compartir con los hijos es una de las mejores experiencias que podemos tener y una mayor enseñanza para su vida futura. Abrazo!!!!"
"1";"1737";"4";"589875958273984";"data";"data.*";"fetched (200)";"2023-10-05 20:53:00.331651";"Facebook:/<comment-id>/comments";"";"Buenazo. Súper rico y fácil. Gracias por tus recetas . Por favor una receta diaria . Magnifica idea de consumir el restante de todo .Saludos . Siempre buena onda Usted ."
"1";"1738";"4";"589875958273984";"data";"data.*";"fetched (200)";"2023-10-05 20:53:00.331651";"Facebook:/<comment-id>/comments";"";"Esa es hermano"
"1";"1739";"4";"589875958273984";"data";"data.*";"fetched (200)";"2023-10-05 20:53:00.331651";"Facebook:/<comment-id>/comments";"";"Felicitaciones, Christian. A aplicar lo aprendido."
"1";"1740";"4";"589875958273984";"data";"data.*";"fetched (200)";"2023-10-05 20:53:00.331651";"Facebook:/<comment-id>/comments";"";"Excelente Christian... Bravo de bravos más naaaa"
"1";"1741";"4";"589875958273984";"data";"data.*";"fetched (200)";"2023-10-05 20:53:00.331651";"Facebook:/<comment-id>/comments";"";"Gracias voy a preparar 😋"
"1";"1742";"4";"589875958273984";"data";"data.*";"fetched (200)";"2023-10-05 20:53:00.331651";"Facebook:/<comment-id>/comments";"";"Andree Núñez, 😋😋😋😋"
"1";"1743";"4";"589875958273984";"data";"data.*";"fetched (200)";"2023-10-05 20:53:00.331651";"Facebook:/<comment-id>/comments";"";"Excelente"
"1";"1744";"4";"589875958273984";"data";"data.*";"fetched (200)";"2023-10-05 20:53:00.331651";"Facebook:/<comment-id>/comments";"";"ESe Aji amarillo dentro de los tallarin es Uhmm que rico .."
"1";"1745";"4";"589875958273984";"data";"data.*";"fetched (200)";"2023-10-05 20:53:00.331651";"Facebook:/<comment-id>/comments";"";"Bravazo👍🏾"
"1";"1746";"4";"589875958273984";"data";"data.*";"fetched (200)";"2023-10-05 20:53:00.331651";"Facebook:/<comment-id>/comments";"";"Jorge Febres .. agradeceme -.-"
"1";"1747";"4";"589875958273984";"data";"data.*";"fetched (200)";"2023-10-05 20:53:00.331651";"Facebook:/<comment-id>/comments";"";"Hola Cris, doy Rossmery Bocanegra desde Ginebra Suiza, me da mucho gusto verte haciendo lo que te gusta con tanto éxito, pero me guste verte más feliz disfrutando de tus hermosos hijos, Dios te bendiga grandemente siempre abrazos y besitos con mucho cariño, hasta siempre bye, 😘🤗🖐️👍👌"
"1";"1748";"4";"589875958273984";"data";"data.*";"fetched (200)";"2023-10-05 20:53:00.331651";"Facebook:/<comment-id>/comments";"";"Me encantan tus recetas y la buena vibra que transmites"
"1";"1749";"4";"589875958273984";"data";"data.*";"fetched (200)";"2023-10-05 20:53:00.331651";"Facebook:/<comment-id>/comments";"";"Me encanta tu forma de enseñar las recetas, aparte q son deli...gracias mil."
"1";"1750";"4";"589875958273984";"data";"data.*";"fetched (200)";"2023-10-05 20:53:00.331651";"Facebook:/<comment-id>/comments";"";"Me encantan tus recetas: fáciles,  rápidas  y económicas, precisas para ahorrar en esta época  de incertidumbre, maximizando recursos... GRACIAS!!!"
"1";"1751";"4";"589875958273984";"data";"data.*";"fetched (200)";"2023-10-05 20:53:00.331651";"Facebook:/<comment-id>/comments";"";"Gracias. Me encantan tus recetas. Son faciles y con lo q se tiene en la heladera."
"1";"1752";"4";"589875958273984";"data";"data.*";"fetched (200)";"2023-10-05 20:53:00.331651";"Facebook:/<comment-id>/comments";"";"No te olvides que el Queso también debe ser Sin Lactosa"
"1";"1753";"4";"589875958273984";"data";"data.*";"fetched (200)";"2023-10-05 20:53:00.331651";"Facebook:/<comment-id>/comments";"";"Muy rica la receta 😘🙏📿❤️🌺🌷🍀🌻☘️"
"1";"1754";"4";"589875958273984";"data";"data.*";"fetched (200)";"2023-10-05 20:53:00.331651";"Facebook:/<comment-id>/comments";"";"Christian muy simpático tu programa da buenas ideas para cocinar. Felicitaciones a Luca y Mikela por completar el staff de cheff!!"
"1";"1755";"4";"589875958273984";"data";"data.*";"fetched (200)";"2023-10-05 20:53:00.331651";"Facebook:/<comment-id>/comments";"";"Espectacularrrrr hoy mismo lo hago (con otras papas) pero me saldrá buenazo cómo todas las recetas que pones!!!! Gracias Christian por compartir tus recetas y secretos sin duda tu y tus hijos mis compañeros de aventura en la cocina!!! 👏🏼👏🏼👏🏼👏🏼"
"1";"1756";"4";"589875958273984";"data";"data.*";"fetched (200)";"2023-10-05 20:53:00.331651";"Facebook:/<comment-id>/comments";"";"Sabes me gusta tus recetas rápidas pero lo q no me gusta son huevos guerekekes di su nombre correcto yo veo mucho de cocina repostería y del extranjero pero tú eres el único q hablas así sin mala intención amigo "
"1";"1757";"4";"589875958273984";"offcut";"";"fetched (200)";"2023-10-05 20:53:00.331651";"Facebook:/<comment-id>/comments";"";""
"1";"1758";"4";"589875958273984";"data";"data.*";"fetched (200)";"2023-10-05 20:53:00.741305";"Facebook:/<comment-id>/comments";"";"Chistian muchas gracias x las recetas al cual empesare con ese arrosito chaufa q se ve delicioso"
"1";"1759";"4";"589875958273984";"data";"data.*";"fetched (200)";"2023-10-05 20:53:00.741305";"Facebook:/<comment-id>/comments";"";"Me  encantas   por  que  teni  la humildad  que sobra en  ty y  a muchos  les falta  para  mi  tu  soy  el mejor del peru    . Y  tus  recetas y   comidas  son   muy  buenas   Muchos  cariños y saludos desde  chile   para ty  y  mi gente  linda    que  llevo  en  mi corazon ❤"
"1";"1760";"4";"589875958273984";"data";"data.*";"fetched (200)";"2023-10-05 20:53:00.741305";"Facebook:/<comment-id>/comments";"";"Me encantan tus recetas, siempre te sigo, porque también me gustos cocinar, me gustaría compartir te mis recetas"
"1";"1761";"4";"589875958273984";"data";"data.*";"fetched (200)";"2023-10-05 20:53:00.741305";"Facebook:/<comment-id>/comments";"";"Se ve muy bueno, Primos esta atendiendo?"
"1";"1762";"4";"589875958273984";"data";"data.*";"fetched (200)";"2023-10-05 20:53:00.741305";"Facebook:/<comment-id>/comments";"";"No deberias de utilizar utensilios de metal en una satén u olla de teflón pero el cocinero se olvidó. Y ni me gusta la forma en que te expresas, nal ejemplo para los niños y tu hija esta preaente en tu video."
"1";"1763";"4";"589875958273984";"data";"data.*";"fetched (200)";"2023-10-05 20:53:00.741305";"Facebook:/<comment-id>/comments";"";"¿Qué hacer con las sobras? De arroz, verduras, menestras, fideos...y que sea fácil y rápido. 🤗 Gracias Christian."
"1";"1764";"4";"589875958273984";"data";"data.*";"fetched (200)";"2023-10-05 20:53:00.741305";"Facebook:/<comment-id>/comments";"";"Christian 😅 y si no tengo papas de esas como hago con las papas?"
"1";"1765";"4";"589875958273984";"data";"data.*";"fetched (200)";"2023-10-05 20:53:00.741305";"Facebook:/<comment-id>/comments";"";"como reduces? quitando la pasta? o le pones mas queso?"
"1";"1766";"4";"589875958273984";"data";"data.*";"fetched (200)";"2023-10-05 20:53:00.741305";"Facebook:/<comment-id>/comments";"";"Bravo !!! La creatividad peruana en su explendor culinaria lo máximo 🤤"
"1";"1767";"4";"589875958273984";"data";"data.*";"fetched (200)";"2023-10-05 20:53:00.741305";"Facebook:/<comment-id>/comments";"";"Se puede usar cebollada roja o siempre tiene q ser blanco."
"1";"1768";"4";"589875958273984";"data";"data.*";"fetched (200)";"2023-10-05 20:53:00.741305";"Facebook:/<comment-id>/comments";"";"Bien Cristián  bravo  trabajamos en asia  con tu gente John  ansiedad  en tu  disco  depeche  frente a  la embajada de usa"
"1";"1769";"4";"589875958273984";"data";"data.*";"fetched (200)";"2023-10-05 20:53:00.741305";"Facebook:/<comment-id>/comments";"";"Transmites paz con cada receta y muy bien acompañado de tus nenes"
"1";"1770";"4";"589875958273984";"data";"data.*";"fetched (200)";"2023-10-05 20:53:00.741305";"Facebook:/<comment-id>/comments";"";"Gracias por sus recetas excelente!!!"
"1";"1771";"4";"589875958273984";"data";"data.*";"fetched (200)";"2023-10-05 20:53:00.741305";"Facebook:/<comment-id>/comments";"";"Gracias por tus recetas no te imaginas como nos ayudas a veces no tengo para cocinar y con pocas cosas q tenemos nos salvas el dia muchas BENDICIONES para ti"
"1";"1772";"4";"589875958273984";"data";"data.*";"fetched (200)";"2023-10-05 20:53:00.741305";"Facebook:/<comment-id>/comments";"";"Eres lo máximo... me encantan tus recetas... mis hijos súper felices.. prepare tu receta de los panqueques y me quedo delicioso...🤪👍"
"1";"1773";"4";"589875958273984";"data";"data.*";"fetched (200)";"2023-10-05 20:53:00.741305";"Facebook:/<comment-id>/comments";"";"BUENÍSIMO...delicioso y sencillos platos con lo que nos queda del día anterior y no desperdiciarlo..Saludos y cariños desde Alemania..."
"1";"1774";"4";"589875958273984";"data";"data.*";"fetched (200)";"2023-10-05 20:53:00.741305";"Facebook:/<comment-id>/comments";"";"Gracias por tus recetas, súper sencillas.... eres un trome"
"1";"1775";"4";"589875958273984";"data";"data.*";"fetched (200)";"2023-10-05 20:53:00.741305";"Facebook:/<comment-id>/comments";"";"Deli receta pero unas consultas 1.las papas del pollo a la brasa es de un día anterior, si es así como lo guardas? Porque suelen secarse 2. Se puede hacer con cebolla roja?"
"1";"1776";"4";"589875958273984";"data";"data.*";"fetched (200)";"2023-10-05 20:53:00.741305";"Facebook:/<comment-id>/comments";"";"Gracias  Christian por las recetas, siempre haciendo participar a tu niños."
"1";"1777";"4";"589875958273984";"data";"data.*";"fetched (200)";"2023-10-05 20:53:00.741305";"Facebook:/<comment-id>/comments";"";"Se ve deli!!! Pero quisiera saber dónde consigo ese tipo de sartenes..."
"1";"1778";"4";"589875958273984";"data";"data.*";"fetched (200)";"2023-10-05 20:53:00.741305";"Facebook:/<comment-id>/comments";"";"Lo mejor de todo es que vemos paso a paso todo y los tips que son lo mejor de tus recetas Eres un Bravo y lindos tus hijos GRACIAS CHRISTIAN."
"1";"1779";"4";"589875958273984";"data";"data.*";"fetched (200)";"2023-10-05 20:53:00.741305";"Facebook:/<comment-id>/comments";"";"Muy buenaa recetas y sencillas."
"1";"1780";"4";"589875958273984";"data";"data.*";"fetched (200)";"2023-10-05 20:53:00.741305";"Facebook:/<comment-id>/comments";"";"A veces no te entiendo lo que hablas....es jerga ?"
"1";"1781";"4";"589875958273984";"data";"data.*";"fetched (200)";"2023-10-05 20:53:00.741305";"Facebook:/<comment-id>/comments";"";"Excelentes recetas y creativas con lo que hay👍"
"1";"1782";"4";"589875958273984";"data";"data.*";"fetched (200)";"2023-10-05 20:53:00.741305";"Facebook:/<comment-id>/comments";"";"Me encanta lo fácil que cocina sin complicaciones y con sus niños muchas ideas para cocinar a mis niños bendiciones 🙏😇"
"1";"1783";"4";"589875958273984";"offcut";"";"fetched (200)";"2023-10-05 20:53:00.741305";"Facebook:/<comment-id>/comments";"";""
"1";"1784";"4";"589875958273984";"data";"data.*";"fetched (200)";"2023-10-05 20:53:01.150070";"Facebook:/<comment-id>/comments";"";"Q recetas tan fáciles de hacer y super económicas fantástico chicos lindos"
"1";"1785";"4";"589875958273984";"data";"data.*";"fetched (200)";"2023-10-05 20:53:01.150070";"Facebook:/<comment-id>/comments";"";"Buenazo Gracias por tus recetas"
"1";"1786";"4";"589875958273984";"data";"data.*";"fetched (200)";"2023-10-05 20:53:01.150070";"Facebook:/<comment-id>/comments";"";"Me encanta todo lo que preparas,son recetas muy fáciles de preparar,gracias"
"1";"1787";"4";"589875958273984";"data";"data.*";"fetched (200)";"2023-10-05 20:53:01.150070";"Facebook:/<comment-id>/comments";"";"Que buenas recetas y lo mejor que son rapidísimas!!!!!"
"1";"1788";"4";"589875958273984";"data";"data.*";"fetched (200)";"2023-10-05 20:53:01.150070";"Facebook:/<comment-id>/comments";"";"Me encantan tus recetas!!!! Lo haces ver re fácil !!!!👏👏👏👏👏"
"1";"1789";"4";"589875958273984";"data";"data.*";"fetched (200)";"2023-10-05 20:53:01.150070";"Facebook:/<comment-id>/comments";"";"Me encantaron,Gracias,a cocinar. !!! 😋😋😋😋😋👍👍👍"
"1";"1790";"4";"589875958273984";"data";"data.*";"fetched (200)";"2023-10-05 20:53:01.150070";"Facebook:/<comment-id>/comments";"";"GRACIAS por todas recetas,ricas,rápidas y muy bien explicadas por ti me encanta lo que compartes todos con tus hijos bellos bendiciones y gracias otra vez 👏🏻👏🏻😍😘🌹🌷🍷"
"1";"1791";"4";"589875958273984";"data";"data.*";"fetched (200)";"2023-10-05 20:53:01.150070";"Facebook:/<comment-id>/comments";"";"Que buenazo gracias por tu receta 🙏👍"
"1";"1792";"4";"589875958273984";"data";"data.*";"fetched (200)";"2023-10-05 20:53:01.150070";"Facebook:/<comment-id>/comments";"";"Gracias por tus recetas ,nos sacas de apuro,cuando no sabemos que más cocinar"
"1";"1793";"4";"589875958273984";"data";"data.*";"fetched (200)";"2023-10-05 20:53:01.150070";"Facebook:/<comment-id>/comments";"";"Buena tu ensalada d atún. Christian lo prepararé.. Gra cías x compartir tus recetas rápidas y practicas"
"1";"1794";"4";"589875958273984";"data";"data.*";"fetched (200)";"2023-10-05 20:53:01.150070";"Facebook:/<comment-id>/comments";"";"Me gustó mucho la tortilla española"
"1";"1795";"4";"589875958273984";"data";"data.*";"fetched (200)";"2023-10-05 20:53:01.150070";"Facebook:/<comment-id>/comments";"";"Christian bravo me puedes decir q mantequilla usas por favor. Le hice como tres fotos de captura y no se ve bien..😅 Y tus recetas buenaz@s!!!"
"1";"1796";"4";"589875958273984";"data";"data.*";"fetched (200)";"2023-10-05 20:53:01.150070";"Facebook:/<comment-id>/comments";"";"Cómo improvisas cristhian cocinas  al toque."
"1";"1797";"4";"589875958273984";"data";"data.*";"fetched (200)";"2023-10-05 20:53:01.150070";"Facebook:/<comment-id>/comments";"";"Prácticas recetas ...me ayudan muchísimo. Gracias !!!"
"1";"1798";"4";"589875958273984";"data";"data.*";"fetched (200)";"2023-10-05 20:53:01.150070";"Facebook:/<comment-id>/comments";"";"La receta quedó bravaza "
"1";"1799";"4";"589875958273984";"data";"data.*";"fetched (200)";"2023-10-05 20:53:01.150070";"Facebook:/<comment-id>/comments";"";"Se supone que el aceite de oliva pierde sus propiedades cuando se calienta, porque algunos cocineros lo usan en los aderezos, el aceite de oliva lo usas al final cuando esta servido el plato, para que no pierda sus propiedades."
"1";"1800";"4";"589875958273984";"data";"data.*";"fetched (200)";"2023-10-05 20:53:01.150070";"Facebook:/<comment-id>/comments";"";"Christian, receta de leche asada, gracias"
"1";"1801";"4";"589875958273984";"data";"data.*";"fetched (200)";"2023-10-05 20:53:01.150070";"Facebook:/<comment-id>/comments";"";"La idea es ingeniarse para no desperdiciar nada, y además deleitarse. Muy bien eres un crack "
"1";"1802";"4";"589875958273984";"data";"data.*";"fetched (200)";"2023-10-05 20:53:01.150070";"Facebook:/<comment-id>/comments";"";"Todo lo que haces es buenazo gracias🍷"
"1";"1803";"4";"589875958273984";"data";"data.*";"fetched (200)";"2023-10-05 20:53:01.150070";"Facebook:/<comment-id>/comments";"";"Buenazo!!! Que buena idea CHRISTIAN! "
"1";"1804";"4";"589875958273984";"data";"data.*";"fetched (200)";"2023-10-05 20:53:01.150070";"Facebook:/<comment-id>/comments";"";"Eres más práctico para cocinar... Y así debe ser"
"1";"1805";"4";"589875958273984";"data";"data.*";"fetched (200)";"2023-10-05 20:53:01.150070";"Facebook:/<comment-id>/comments";"";"Que bellos hijos ,compartiendo esos momentos"
"1";"1806";"4";"589875958273984";"data";"data.*";"fetched (200)";"2023-10-05 20:53:01.150070";"Facebook:/<comment-id>/comments";"";"Recien veo este video... un exito!!! Yo lo hice con las papitas extras que me quedaron del ají de pollo y le añadí un par de champiñones.... un éxito de cena. Gracias Christian Bravo!!! 👏🏻👏🏻👏🏻"
"1";"1807";"4";"589875958273984";"data";"data.*";"fetched (200)";"2023-10-05 20:53:01.150070";"Facebook:/<comment-id>/comments";"";"Me encanta ver como tus hijos disfrutan contigo de hacer y comer lo que hacen, felicidades"
"1";"1808";"4";"589875958273984";"data";"data.*";"fetched (200)";"2023-10-05 20:53:01.150070";"Facebook:/<comment-id>/comments";"";"Christian aparte de las ricas recetas también envianos truquitos ¡¡¡¡"
"1";"1809";"4";"589875958273984";"offcut";"";"fetched (200)";"2023-10-05 20:53:01.150070";"Facebook:/<comment-id>/comments";"";""
"1";"1810";"4";"589875958273984";"data";"data.*";"fetched (200)";"2023-10-05 20:53:01.447118";"Facebook:/<comment-id>/comments";"";"Oishisoo !!! Se ve sabroso Saludos de Japón "
"1";"1811";"4";"589875958273984";"data";"data.*";"fetched (200)";"2023-10-05 20:53:01.447118";"Facebook:/<comment-id>/comments";"";"Buenazo!!! Comparte como hacer pastel de papa con queso. Gracias y lo felicito."
"1";"1812";"4";"589875958273984";"data";"data.*";"fetched (200)";"2023-10-05 20:53:01.447118";"Facebook:/<comment-id>/comments";"";"Preciosa Mikela, igualita a su Mamá!!!💜💜💜"
"1";"1813";"4";"589875958273984";"data";"data.*";"fetched (200)";"2023-10-05 20:53:01.447118";"Facebook:/<comment-id>/comments";"";"linda micaelaa  gracias  prepare los tallarines verdes me salieronn super graciasss siempre los sigo"
"1";"1814";"4";"589875958273984";"data";"data.*";"fetched (200)";"2023-10-05 20:53:01.447118";"Facebook:/<comment-id>/comments";"";"Gracias por tus recetas, nada se bota...todo se usa además de fáciles, rápidas y amenas☺️ESPECTACULARES‼️"
"1";"1815";"4";"589875958273984";"data";"data.*";"fetched (200)";"2023-10-05 20:53:01.447118";"Facebook:/<comment-id>/comments";"";"De todos los vídeos de cocina, me quedo con  el tuyo Christian se ve tan familiar con tus hijos y además se nota que te admiran. Felicitaciones"
"1";"1816";"4";"589875958273984";"data";"data.*";"fetched (200)";"2023-10-05 20:53:01.447118";"Facebook:/<comment-id>/comments";"";"Que rico Tortilla de huevo con algunos sobrantes del Refrigerador"
"1";"1817";"4";"589875958273984";"data";"data.*";"fetched (200)";"2023-10-05 20:53:01.447118";"Facebook:/<comment-id>/comments";"";"Como siempre buenazo.  Cocinar es un acto de amor."
"1";"1818";"4";"589875958273984";"data";"data.*";"fetched (200)";"2023-10-05 20:53:01.447118";"Facebook:/<comment-id>/comments";"";"Lorena Lore una tortilla de papa! "
"1";"1819";"4";"589875958273984";"data";"data.*";"fetched (200)";"2023-10-05 20:53:01.447118";"Facebook:/<comment-id>/comments";"";"Siempre transmitiendo alegría el buen Cristian."
"1";"1820";"4";"589875958273984";"data";"data.*";"fetched (200)";"2023-10-05 20:53:01.447118";"Facebook:/<comment-id>/comments";"";"Te admiro bravo, gracias x todo"
"1";"1821";"4";"589875958273984";"data";"data.*";"fetched (200)";"2023-10-05 20:53:01.447118";"Facebook:/<comment-id>/comments";"";"Nataly Suyon miraaaa...súper fácil y ricoooo."
"1";"1822";"4";"589875958273984";"data";"data.*";"fetched (200)";"2023-10-05 20:53:01.447118";"Facebook:/<comment-id>/comments";"";"Hablar  bien no m entero  este m raya"
"1";"1823";"4";"589875958273984";"data";"data.*";"fetched (200)";"2023-10-05 20:53:01.447118";"Facebook:/<comment-id>/comments";"";"Ni más voto las papas fritas q sobran 🤣👍👍👍👍"
"1";"1824";"4";"589875958273984";"data";"data.*";"fetched (200)";"2023-10-05 20:53:01.447118";"Facebook:/<comment-id>/comments";"";"Muy aparte de tus recetas me gusta mucho como compartes con tu hija te felicito"
"1";"1825";"4";"589875958273984";"data";"data.*";"fetched (200)";"2023-10-05 20:53:01.447118";"Facebook:/<comment-id>/comments";"";"Gracias"
"1";"1826";"4";"589875958273984";"data";"data.*";"fetched (200)";"2023-10-05 20:53:01.447118";"Facebook:/<comment-id>/comments";"";"Bien jugado bravo. "
"1";"1827";"4";"589875958273984";"data";"data.*";"fetched (200)";"2023-10-05 20:53:01.447118";"Facebook:/<comment-id>/comments";"";"Eres un capo bro!!! Gracias por tan buena vibra 👍 bendiciones para ti y tu familia "
"1";"1828";"4";"589875958273984";"data";"data.*";"fetched (200)";"2023-10-05 20:53:01.447118";"Facebook:/<comment-id>/comments";"";"Como reduces el jugo que te quedo??"
"1";"1829";"4";"589875958273984";"data";"data.*";"fetched (200)";"2023-10-05 20:53:01.447118";"Facebook:/<comment-id>/comments";"";"Que rico mira Harold Morales para que me prepares 😋"
"1";"1830";"4";"589875958273984";"data";"data.*";"fetched (200)";"2023-10-05 20:53:01.447118";"Facebook:/<comment-id>/comments";"";"Me encanta tu team👍🏽🙌🏽🥰"
"1";"1831";"4";"589875958273984";"data";"data.*";"fetched (200)";"2023-10-05 20:53:01.447118";"Facebook:/<comment-id>/comments";"";"Para la crema de queso... puedo usar otro queso que no sea edam?  Gracias por lo práctico en tus recetas!"
"1";"1832";"4";"589875958273984";"data";"data.*";"fetched (200)";"2023-10-05 20:53:01.447118";"Facebook:/<comment-id>/comments";"";"Li Jisol"
"1";"1833";"4";"589875958273984";"data";"data.*";"fetched (200)";"2023-10-05 20:53:01.447118";"Facebook:/<comment-id>/comments";"";"KarenVasquez engriemeee por favor"
"1";"1834";"4";"589875958273984";"data";"data.*";"fetched (200)";"2023-10-05 20:53:01.447118";"Facebook:/<comment-id>/comments";"";"Ahhh concuerdo con Cecilia que sería súper bien que nos des más recetas con lo que que a veces nos sobra de una comida anterior! Vivo en USA y aquí siempre te sirven mucho en los restaurantes y es normal que te traigas lo q t sobro... pero sino te lo comes “más tarde” terminas botándolo!"
"1";"1835";"4";"589875958273984";"offcut";"";"fetched (200)";"2023-10-05 20:53:01.447118";"Facebook:/<comment-id>/comments";"";""
"1";"1836";"4";"589875958273984";"data";"data.*";"fetched (200)";"2023-10-05 20:53:02.277508";"Facebook:/<comment-id>/comments";"";"Maria Eugenia Rendón Begazo"
"1";"1837";"4";"589875958273984";"data";"data.*";"fetched (200)";"2023-10-05 20:53:02.277508";"Facebook:/<comment-id>/comments";"";"Karina Del Carpio Castillo"
"1";"1838";"4";"589875958273984";"data";"data.*";"fetched (200)";"2023-10-05 20:53:02.277508";"Facebook:/<comment-id>/comments";"";"Tus comidas son ricas pero xq no enseñar a preparar comida sin aceita con productos bajos en grasa! Sin mantequilla, aceites"
"1";"1839";"4";"589875958273984";"data";"data.*";"fetched (200)";"2023-10-05 20:53:02.277508";"Facebook:/<comment-id>/comments";"";"Hola Christian te sigo y me encantan tus recetas eres práctico, porque no utilizas la cuchara de palo para cocinar?"
