"level";"id";"parent_id";"object_id";"object_type";"object_key";"query_status";"query_time";"query_type";"name";"message"
"1";"1106";"1";"779267716640417";"data";"data.*";"fetched (200)";"2023-09-25 21:40:54.189802";"Facebook:/<post-id>/comments";"";"Jajaja me la creí 😂😂"
"1";"1107";"1";"779267716640417";"data";"data.*";"fetched (200)";"2023-09-25 21:40:54.189802";"Facebook:/<post-id>/comments";"";"Jajajaja que buena reflexion"
"1";"1108";"1";"779267716640417";"data";"data.*";"fetched (200)";"2023-09-25 21:40:54.189802";"Facebook:/<post-id>/comments";"";"Ésto está más arreglado. El papá con peluca y la mamá más sobreactuada!!!"
"1";"1109";"1";"779267716640417";"data";"data.*";"fetched (200)";"2023-09-25 21:40:54.189802";"Facebook:/<post-id>/comments";"";"Deberías de ver personas maravillosas así veas más creatividad está vez pésimo ni Óscar ni nada actuación mala 👎"
"1";"1110";"1";"779267716640417";"data";"data.*";"fetched (200)";"2023-09-25 21:40:54.189802";"Facebook:/<post-id>/comments";"";"Esa morena tampoco esta para despreciar, gran actuacion toyin."
"1";"1111";"1";"779267716640417";"data";"data.*";"fetched (200)";"2023-09-25 21:40:54.189802";"Facebook:/<post-id>/comments";"";"Jajajajaj yo soy color chaufa jajajaja"
"1";"1112";"1";"779267716640417";"data";"data.*";"fetched (200)";"2023-09-25 21:40:54.189802";"Facebook:/<post-id>/comments";"";"Venti??"
"1";"1113";"1";"779267716640417";"data";"data.*";"fetched (200)";"2023-09-25 21:40:54.189802";"Facebook:/<post-id>/comments";"";"si muy bueno, buena actuación"
"1";"1114";"1";"779267716640417";"data";"data.*";"fetched (200)";"2023-09-25 21:40:54.189802";"Facebook:/<post-id>/comments";"";"Lo que si no se puede negar q la zamba tiene buen cul...."
"1";"1115";"1";"779267716640417";"data";"data.*";"fetched (200)";"2023-09-25 21:40:54.189802";"Facebook:/<post-id>/comments";"";"Jajajajajaja jajajajajaja jajajajajaja Se Pasaron"
"1";"1116";"1";"779267716640417";"data";"data.*";"fetched (200)";"2023-09-25 21:40:54.189802";"Facebook:/<post-id>/comments";"";"Cualquier día lo van a dormir al toyo tmr 😂"
"1";"1117";"1";"779267716640417";"data";"data.*";"fetched (200)";"2023-09-25 21:40:54.189802";"Facebook:/<post-id>/comments";"";"Ksaama N Ramos  mi viejo  kuando te presente a mi familia"
"1";"1118";"1";"779267716640417";"data";"data.*";"fetched (200)";"2023-09-25 21:40:54.189802";"Facebook:/<post-id>/comments";"";"Buena ese toyo actuo re bien 😂"
"1";"1119";"1";"779267716640417";"offcut";"";"fetched (200)";"2023-09-25 21:40:54.189802";"Facebook:/<post-id>/comments";"";""
"1";"1120";"1";"779267716640417";"data";"data.*";"fetched (200)";"2023-09-25 21:40:54.737029";"Facebook:/<post-id>/comments";"";"Malcricarmen Alva es la mamá del novio???"
"1";"1121";"1";"779267716640417";"data";"data.*";"fetched (200)";"2023-09-25 21:40:54.737029";"Facebook:/<post-id>/comments";"";"Ese toyo exaltándose es un éxito xD"
"1";"1122";"1";"779267716640417";"data";"data.*";"fetched (200)";"2023-09-25 21:40:54.737029";"Facebook:/<post-id>/comments";"";"Bryan Gutierrez el Vico jajaja"
"1";"1123";"1";"779267716640417";"data";"data.*";"fetched (200)";"2023-09-25 21:40:54.737029";"Facebook:/<post-id>/comments";"";"También buena actuación de la señora"
"1";"1124";"1";"779267716640417";"data";"data.*";"fetched (200)";"2023-09-25 21:40:54.737029";"Facebook:/<post-id>/comments";"";"Que originales estos fumekes"
"1";"1125";"1";"779267716640417";"data";"data.*";"fetched (200)";"2023-09-25 21:40:54.737029";"Facebook:/<post-id>/comments";"";"Ya estan palta los personajes"
"1";"1126";"1";"779267716640417";"data";"data.*";"fetched (200)";"2023-09-25 21:40:54.737029";"Facebook:/<post-id>/comments";"";"Mari Fran  caxa"
"1";"1127";"1";"779267716640417";"data";"data.*";"fetched (200)";"2023-09-25 21:40:54.737029";"Facebook:/<post-id>/comments";"";"Vanny Maccat xd"
"1";"1128";"1";"779267716640417";"data";"data.*";"fetched (200)";"2023-09-25 21:40:54.737029";"Facebook:/<post-id>/comments";"";"Esto si es calidad audiovisual"
"1";"1129";"1";"779267716640417";"data";"data.*";"fetched (200)";"2023-09-25 21:40:54.737029";"Facebook:/<post-id>/comments";"";"Jose Luis Morales Teodoro yo no te discrimino mi amor JAJAJAJA"
"1";"1130";"1";"779267716640417";"data";"data.*";"fetched (200)";"2023-09-25 21:40:54.737029";"Facebook:/<post-id>/comments";"";"JAJJAJAJAJJAJAJAJAJJAJAJAJAJJAJAJAJAJAJAJ son lo máximo!!!"
"1";"1131";"1";"779267716640417";"data";"data.*";"fetched (200)";"2023-09-25 21:40:54.737029";"Facebook:/<post-id>/comments";"";"El Toyo es mejor actor que Giovanni Siccia 😆"
"1";"1132";"1";"779267716640417";"data";"data.*";"fetched (200)";"2023-09-25 21:40:54.737029";"Facebook:/<post-id>/comments";"";"Esta más actuado chiiii"
"1";"1133";"1";"779267716640417";"data";"data.*";"fetched (200)";"2023-09-25 21:40:54.737029";"Facebook:/<post-id>/comments";"";"PM..... estaba seguro que era real,  Malcricarmen Alva y López Aliaga en  acción."
"1";"1134";"1";"779267716640417";"data";"data.*";"fetched (200)";"2023-09-25 21:40:54.737029";"Facebook:/<post-id>/comments";"";"La Malcricarmen y la Barbaran"
"1";"1135";"1";"779267716640417";"data";"data.*";"fetched (200)";"2023-09-25 21:40:54.737029";"Facebook:/<post-id>/comments";"";"Excelente reto ,y excelente a las señoras !"
"1";"1136";"1";"779267716640417";"data";"data.*";"fetched (200)";"2023-09-25 21:40:54.737029";"Facebook:/<post-id>/comments";"";"Que estupidez..."
"1";"1137";"1";"779267716640417";"data";"data.*";"fetched (200)";"2023-09-25 21:40:54.737029";"Facebook:/<post-id>/comments";"";"Bajandola"
"1";"1138";"1";"779267716640417";"data";"data.*";"fetched (200)";"2023-09-25 21:40:54.737029";"Facebook:/<post-id>/comments";"";"Estos comediantes creen que están en los años 50... No pueden hacer comedias de temas más actuales.."
"1";"1139";"1";"779267716640417";"data";"data.*";"fetched (200)";"2023-09-25 21:40:54.737029";"Facebook:/<post-id>/comments";"";"Me dió risa que el viejo se desmayó y a todos les valió vrg 😂😂😂😂😂😂"
"1";"1140";"1";"779267716640417";"data";"data.*";"fetched (200)";"2023-09-25 21:40:54.737029";"Facebook:/<post-id>/comments";"";"Venti? xD!!!"
"1";"1141";"1";"779267716640417";"data";"data.*";"fetched (200)";"2023-09-25 21:40:54.737029";"Facebook:/<post-id>/comments";"";"Damian y el Toyo .. chupenmela!"
"1";"1142";"1";"779267716640417";"data";"data.*";"fetched (200)";"2023-09-25 21:40:54.737029";"Facebook:/<post-id>/comments";"";"Jajaja es venti"
"1";"1143";"1";"779267716640417";"data";"data.*";"fetched (200)";"2023-09-25 21:40:54.737029";"Facebook:/<post-id>/comments";"";"Que buena Causita son La Cagada....eee...😂😃😄😅🤣...y que viva el Peru...costa sierra y nuestra gran...selva....y no al Racismo....porq todos somos de un Dios de...Amor....Dios los bendiga...."
"1";"1144";"1";"779267716640417";"data";"data.*";"fetched (200)";"2023-09-25 21:40:54.737029";"Facebook:/<post-id>/comments";"";"Buena actuación de las congresistas 😅 😅 😅 😅 😅 😅 😅 😅"
"1";"1145";"1";"779267716640417";"offcut";"";"fetched (200)";"2023-09-25 21:40:54.737029";"Facebook:/<post-id>/comments";"";""
"1";"1146";"1";"779267716640417";"data";"data.*";"fetched (200)";"2023-09-25 21:40:55.205479";"Facebook:/<post-id>/comments";"";"Rocio Del Pilar Reategui Rengifo moshi"
"1";"1147";"1";"779267716640417";"data";"data.*";"fetched (200)";"2023-09-25 21:40:55.205479";"Facebook:/<post-id>/comments";"";"Le hubiese roto la boca a ese viejo huevón"
"1";"1148";"1";"779267716640417";"data";"data.*";"fetched (200)";"2023-09-25 21:40:55.205479";"Facebook:/<post-id>/comments";"";"Definitivamente es cine."
"1";"1149";"1";"779267716640417";"data";"data.*";"fetched (200)";"2023-09-25 21:40:55.205479";"Facebook:/<post-id>/comments";"";"Esta escena, lamentablemente sigue ocurriendo aún en esta época y en este país pluricultural...  Esta escena, que sabemos es actuada, aún así indigna. Y qué bueno que haya gente que haya defendido a esa chica, eso dice mucho de ellos como persona. Aún así hay muchos que nos mantenemos como espectadores ante estas situaciones."
"1";"1150";"1";"779267716640417";"data";"data.*";"fetched (200)";"2023-09-25 21:40:55.205479";"Facebook:/<post-id>/comments";"";"Buen actor el tío, debería estar en la tele"
"1";"1151";"1";"779267716640417";"data";"data.*";"fetched (200)";"2023-09-25 21:40:55.205479";"Facebook:/<post-id>/comments";"";"Armani"
"1";"1152";"1";"779267716640417";"data";"data.*";"fetched (200)";"2023-09-25 21:40:55.205479";"Facebook:/<post-id>/comments";"";"UN BUEN VIDEO DE HUMOR CON UN BUEN MENSAJE PROFUNDO"
"1";"1153";"1";"779267716640417";"data";"data.*";"fetched (200)";"2023-09-25 21:40:55.205479";"Facebook:/<post-id>/comments";"";"Bien gente"
"1";"1154";"1";"779267716640417";"data";"data.*";"fetched (200)";"2023-09-25 21:40:55.205479";"Facebook:/<post-id>/comments";"";"Buenaza"
"1";"1155";"1";"779267716640417";"data";"data.*";"fetched (200)";"2023-09-25 21:40:55.205479";"Facebook:/<post-id>/comments";"";"Eso no es actuación es realismo puro."
"1";"1156";"1";"779267716640417";"data";"data.*";"fetched (200)";"2023-09-25 21:40:55.205479";"Facebook:/<post-id>/comments";"";"Son recontra verracos 🤣🤣🤣"
"1";"1157";"1";"779267716640417";"data";"data.*";"fetched (200)";"2023-09-25 21:40:55.205479";"Facebook:/<post-id>/comments";"";"Faltaba Goyita"
"1";"1158";"1";"779267716640417";"data";"data.*";"fetched (200)";"2023-09-25 21:40:55.205479";"Facebook:/<post-id>/comments";"";"Olle pelando cabeza de rodilla?! 😂 Cuando agas tus descargo como actuacion.. No es necesario exsajerar tu actuacion .. Por que quita lo real.."
"1";"1159";"1";"779267716640417";"data";"data.*";"fetched (200)";"2023-09-25 21:40:55.205479";"Facebook:/<post-id>/comments";"";"HEROE URBANO JAJAJA"
"1";"1160";"1";"779267716640417";"data";"data.*";"fetched (200)";"2023-09-25 21:40:55.205479";"Facebook:/<post-id>/comments";"";"Ese Jaze está en todas"
"1";"1161";"1";"779267716640417";"data";"data.*";"fetched (200)";"2023-09-25 21:40:55.205479";"Facebook:/<post-id>/comments";"";"Para todos los ignorantes..!!  Esto noes una broma ó payasada de Damian y el Toyo. Es un experimento para observar la reaccion de ciudadanos ejemplares, protejedores. Y tambien los otros ciudadanos quedados que no se meten en cualquier injusticia."
"1";"1162";"1";"779267716640417";"data";"data.*";"fetched (200)";"2023-09-25 21:40:55.205479";"Facebook:/<post-id>/comments";"";"Creo que exageraron un poquito 😁"
"1";"1163";"1";"779267716640417";"data";"data.*";"fetched (200)";"2023-09-25 21:40:55.205479";"Facebook:/<post-id>/comments";"";"De han copiado del programa español jajana"
"1";"1164";"1";"779267716640417";"data";"data.*";"fetched (200)";"2023-09-25 21:40:55.205479";"Facebook:/<post-id>/comments";"";"Cinthya Vanesa Vivas Aranda mira hajaj"
"1";"1165";"1";"779267716640417";"data";"data.*";"fetched (200)";"2023-09-25 21:40:55.205479";"Facebook:/<post-id>/comments";"";"Quitan la emoción cuando es actuado, mejor era que todo sea sorpresivo y verídico"
"1";"1166";"1";"779267716640417";"data";"data.*";"fetched (200)";"2023-09-25 21:40:55.205479";"Facebook:/<post-id>/comments";"";"Que buen hano tiene la jermita"
"1";"1167";"1";"779267716640417";"data";"data.*";"fetched (200)";"2023-09-25 21:40:55.205479";"Facebook:/<post-id>/comments";"";"Que buenos actores...                          Y sólo las mujeres se levantaron a defenderla."
"1";"1168";"1";"779267716640417";"data";"data.*";"fetched (200)";"2023-09-25 21:40:55.205479";"Facebook:/<post-id>/comments";"";"Xd"
"1";"1169";"1";"779267716640417";"data";"data.*";"fetched (200)";"2023-09-25 21:40:55.205479";"Facebook:/<post-id>/comments";"";"Todo por la culpa de esa negra haahahahaah se pasan"
"1";"1170";"1";"779267716640417";"data";"data.*";"fetched (200)";"2023-09-25 21:40:55.205479";"Facebook:/<post-id>/comments";"";"Vuelvan hacer las reales cámaras indiscreta franco aburren con sus actuaciones"
"1";"1171";"1";"779267716640417";"offcut";"";"fetched (200)";"2023-09-25 21:40:55.205479";"Facebook:/<post-id>/comments";"";""
"1";"1172";"1";"779267716640417";"data";"data.*";"fetched (200)";"2023-09-25 21:40:55.850874";"Facebook:/<post-id>/comments";"";"Lo malo es que lo pasan por wilax"
"1";"1173";"1";"779267716640417";"data";"data.*";"fetched (200)";"2023-09-25 21:40:55.850874";"Facebook:/<post-id>/comments";"";"2 oscar para toyoooo cara jooo"
"1";"1174";"1";"779267716640417";"data";"data.*";"fetched (200)";"2023-09-25 21:40:55.850874";"Facebook:/<post-id>/comments";"";"nooo ventii"
"1";"1175";"1";"779267716640417";"data";"data.*";"fetched (200)";"2023-09-25 21:40:55.850874";"Facebook:/<post-id>/comments";"";"Luis Jonatan Zamora el nombre del restaurante me hizo acordar a la basílica jajajjajajajaja"
"1";"1176";"1";"779267716640417";"data";"data.*";"fetched (200)";"2023-09-25 21:40:55.850874";"Facebook:/<post-id>/comments";"";"La mamá no era Maricarmen Alva"
"1";"1177";"1";"779267716640417";"data";"data.*";"fetched (200)";"2023-09-25 21:40:55.850874";"Facebook:/<post-id>/comments";"";"Que tal actores, el Oscar para el toyin Porfavor, mi más grande bendiciónes!  Actorasos!!!"
"1";"1178";"1";"779267716640417";"data";"data.*";"fetched (200)";"2023-09-25 21:40:55.850874";"Facebook:/<post-id>/comments";"";"Tmre  parece hasta real ya   ,   yo  si me la creo  Xd"
"1";"1179";"1";"779267716640417";"data";"data.*";"fetched (200)";"2023-09-25 21:40:55.850874";"Facebook:/<post-id>/comments";"";"Amigos no es por nada pero Les salio mal y pésima la actuación  Osea tienen que hacer algo más innovador  Aparte la señora nada le sale al natural."
"1";"1180";"1";"779267716640417";"data";"data.*";"fetched (200)";"2023-09-25 21:40:55.850874";"Facebook:/<post-id>/comments";"";"No saben actuar"
"1";"1181";"1";"779267716640417";"data";"data.*";"fetched (200)";"2023-09-25 21:40:55.850874";"Facebook:/<post-id>/comments";"";"Quieres que tu mujer sea una bailarinaaaa 🤣🤣🤣🤣"
"1";"1182";"1";"779267716640417";"data";"data.*";"fetched (200)";"2023-09-25 21:40:55.850874";"Facebook:/<post-id>/comments";"";"Buenos actores👏Aunque la peluca es mas falsa 😂"
"1";"1183";"1";"779267716640417";"data";"data.*";"fetched (200)";"2023-09-25 21:40:55.850874";"Facebook:/<post-id>/comments";"";"Y más cuando es igual a un capítulo de un programa español  sólo que más exagerado el papá"
"1";"1184";"1";"779267716640417";"data";"data.*";"fetched (200)";"2023-09-25 21:40:55.850874";"Facebook:/<post-id>/comments";"";"Así Sea De Broma Yo Le Rompia El Hocico, Como No Llegan Estas Bromitas a Mi Lado"
"1";"1185";"1";"779267716640417";"data";"data.*";"fetched (200)";"2023-09-25 21:40:55.850874";"Facebook:/<post-id>/comments";"";"Solo tengo una palabra MAGISTRAL !!"
"1";"1186";"1";"779267716640417";"data";"data.*";"fetched (200)";"2023-09-25 21:40:55.850874";"Facebook:/<post-id>/comments";"";"Carolina Hidalgo cuando me conozcan 🤡 xd"
"1";"1187";"1";"779267716640417";"data";"data.*";"fetched (200)";"2023-09-25 21:40:55.850874";"Facebook:/<post-id>/comments";"";"Para empezar q feo es decir negra ,no debería ser de color"
"1";"1188";"1";"779267716640417";"data";"data.*";"fetched (200)";"2023-09-25 21:40:55.850874";"Facebook:/<post-id>/comments";"";"Ella no es la congresista Bárbara 🤔"
"1";"1189";"1";"779267716640417";"data";"data.*";"fetched (200)";"2023-09-25 21:40:55.850874";"Facebook:/<post-id>/comments";"";"Que rica morena es bella"
"1";"1190";"1";"779267716640417";"data";"data.*";"fetched (200)";"2023-09-25 21:40:55.850874";"Facebook:/<post-id>/comments";"";"El color de mi camisaaa 🤣🤣😂"
"1";"1191";"1";"779267716640417";"data";"data.*";"fetched (200)";"2023-09-25 21:40:55.850874";"Facebook:/<post-id>/comments";"";"Jajajaj xd El Man: Ta bueno el chisme."
"1";"1192";"1";"779267716640417";"data";"data.*";"fetched (200)";"2023-09-25 21:40:55.850874";"Facebook:/<post-id>/comments";"";"RIDICULO VIDEO.  Quien no va a reconocer esa voz de chilloso y bullera del toyo.? Así q cualquier persona se daría cuenta que es actuado."
"1";"1193";"1";"779267716640417";"data";"data.*";"fetched (200)";"2023-09-25 21:40:55.850874";"Facebook:/<post-id>/comments";"";"El padre es un actorazo!!"
"1";"1194";"1";"779267716640417";"data";"data.*";"fetched (200)";"2023-09-25 21:40:55.850874";"Facebook:/<post-id>/comments";"";"De que pais son!!!!! actorasos carajo!!!!!!!"
"1";"1195";"1";"779267716640417";"data";"data.*";"fetched (200)";"2023-09-25 21:40:55.850874";"Facebook:/<post-id>/comments";"";"Ni siccia lo hacía mejor"
"1";"1196";"1";"779267716640417";"data";"data.*";"fetched (200)";"2023-09-25 21:40:55.850874";"Facebook:/<post-id>/comments";"";"Y si llegaba un ""héroe"" y le metía un puñetazo de knock out a su actor ? 🤣🤣"
"1";"1197";"1";"779267716640417";"offcut";"";"fetched (200)";"2023-09-25 21:40:55.850874";"Facebook:/<post-id>/comments";"";""
"1";"1198";"1";"779267716640417";"data";"data.*";"fetched (200)";"2023-09-25 21:40:56.356685";"Facebook:/<post-id>/comments";"";"Top 5 de actores que olvidaron que estaban actuando xd"
"1";"1199";"1";"779267716640417";"data";"data.*";"fetched (200)";"2023-09-25 21:40:56.356685";"Facebook:/<post-id>/comments";"";"Daniel Ivan oe agarra a tu tío el toyo xdxd"
"1";"1200";"1";"779267716640417";"data";"data.*";"fetched (200)";"2023-09-25 21:40:56.356685";"Facebook:/<post-id>/comments";"";"Par de aburridos"
"1";"1201";"1";"779267716640417";"data";"data.*";"fetched (200)";"2023-09-25 21:40:56.356685";"Facebook:/<post-id>/comments";"";"Hasta q xfin están haciendo algo bueno👌👌👌"
"1";"1202";"1";"779267716640417";"data";"data.*";"fetched (200)";"2023-09-25 21:40:56.356685";"Facebook:/<post-id>/comments";"";"Esa actuación es más cómica que el programa de JB, parece Vilchez haciendo de pituco 😂😂😂😂😂"
"1";"1203";"1";"779267716640417";"data";"data.*";"fetched (200)";"2023-09-25 21:40:56.356685";"Facebook:/<post-id>/comments";"";"XD"
"1";"1204";"1";"779267716640417";"data";"data.*";"fetched (200)";"2023-09-25 21:40:56.356685";"Facebook:/<post-id>/comments";"";"Sin duda alguna un oscar para toyo jajajaja"
"1";"1205";"1";"779267716640417";"data";"data.*";"fetched (200)";"2023-09-25 21:40:56.356685";"Facebook:/<post-id>/comments";"";"A pero después cuando les roben su billetera van a quedar como 🤡"
"1";"1206";"1";"779267716640417";"data";"data.*";"fetched (200)";"2023-09-25 21:40:56.356685";"Facebook:/<post-id>/comments";"";"Solo una mujer les sale al frente y el resto son unos idiotaso se dieron cuenta q eran malos actores"
"1";"1207";"1";"779267716640417";"data";"data.*";"fetched (200)";"2023-09-25 21:40:56.356685";"Facebook:/<post-id>/comments";"";"Exelente, estos si son buenos actores."
"1";"1208";"1";"779267716640417";"data";"data.*";"fetched (200)";"2023-09-25 21:40:56.356685";"Facebook:/<post-id>/comments";"";"Dudó que sea actuación eso en verdad lo que piensan pero nunca lo van aceptar"
"1";"1209";"1";"779267716640417";"data";"data.*";"fetched (200)";"2023-09-25 21:40:56.356685";"Facebook:/<post-id>/comments";"";"Vaya negrota"
"1";"1210";"1";"779267716640417";"data";"data.*";"fetched (200)";"2023-09-25 21:40:56.356685";"Facebook:/<post-id>/comments";"";"Mejor llamen a desconocidos :("
"1";"1211";"1";"779267716640417";"data";"data.*";"fetched (200)";"2023-09-25 21:40:56.356685";"Facebook:/<post-id>/comments";"";"Se nota la peluca y creo que todos pueden reconocer la voz de el toyo"
"1";"1212";"1";"779267716640417";"data";"data.*";"fetched (200)";"2023-09-25 21:40:56.356685";"Facebook:/<post-id>/comments";"";"No entiendo a quien le hacen la broma"
"1";"1213";"1";"779267716640417";"data";"data.*";"fetched (200)";"2023-09-25 21:40:56.356685";"Facebook:/<post-id>/comments";"";"JAJAJJAJAJA GRACIAS TOYO, BUEN ACTOR UN CRACK 🤣"
"1";"1214";"1";"779267716640417";"data";"data.*";"fetched (200)";"2023-09-25 21:40:56.356685";"Facebook:/<post-id>/comments";"";"No es la del congreso, hay bille"
"1";"1215";"1";"779267716640417";"data";"data.*";"fetched (200)";"2023-09-25 21:40:56.356685";"Facebook:/<post-id>/comments";"";"Sigan aportando a la sociedad con su talento muchachos. 👏"
"1";"1216";"1";"779267716640417";"data";"data.*";"fetched (200)";"2023-09-25 21:40:56.356685";"Facebook:/<post-id>/comments";"";"Es Venti el chico"
"1";"1217";"1";"779267716640417";"data";"data.*";"fetched (200)";"2023-09-25 21:40:56.356685";"Facebook:/<post-id>/comments";"";"Buena actuación de Toyo pero se lucieron haciendo actuar a la Malcricarmen 🤣🤣🤣"
"1";"1218";"1";"779267716640417";"data";"data.*";"fetched (200)";"2023-09-25 21:40:56.356685";"Facebook:/<post-id>/comments";"";"Yo solo salgo a defender a los viejos y a los niños....los demas se pueden defender solos...✌🏻"
"1";"1219";"1";"779267716640417";"data";"data.*";"fetched (200)";"2023-09-25 21:40:56.356685";"Facebook:/<post-id>/comments";"";"Quien sabe el face de la chica kiara porfavor..."
"1";"1220";"1";"779267716640417";"data";"data.*";"fetched (200)";"2023-09-25 21:40:56.356685";"Facebook:/<post-id>/comments";"";"Se meten a un restaurante con puras mujeres de clientas para que no lo suenen... Miedo?"
"1";"1221";"1";"779267716640417";"data";"data.*";"fetched (200)";"2023-09-25 21:40:56.356685";"Facebook:/<post-id>/comments";"";"Ya parece el congreso sacandose los ojos entre ellos"
"1";"1222";"1";"779267716640417";"data";"data.*";"fetched (200)";"2023-09-25 21:40:56.356685";"Facebook:/<post-id>/comments";"";"Alea Tcast para que te rías jaja"
"1";"1223";"1";"779267716640417";"offcut";"";"fetched (200)";"2023-09-25 21:40:56.356685";"Facebook:/<post-id>/comments";"";""
"1";"1224";"1";"779267716640417";"data";"data.*";"fetched (200)";"2023-09-25 21:40:56.842039";"Facebook:/<post-id>/comments";"";"jajaaj al toque uno se da cuenta que es armado  y más se le reconoce la voz del toyo"
"1";"1225";"1";"779267716640417";"data";"data.*";"fetched (200)";"2023-09-25 21:40:56.842039";"Facebook:/<post-id>/comments";"";"Doa mundos paralelos jaJhH Hussein Lanazca Mercado"
"1";"1226";"1";"779267716640417";"data";"data.*";"fetched (200)";"2023-09-25 21:40:56.842039";"Facebook:/<post-id>/comments";"";"LA MAMÁ SE LO TOMO MUY APECHO JAJAJAJAJAJAJAJAJAJAJAJAJAJAJAJAJAJAJAJA"
"1";"1227";"1";"779267716640417";"data";"data.*";"fetched (200)";"2023-09-25 21:40:56.842039";"Facebook:/<post-id>/comments";"";"Hummm .. y que importa la aprobación de sus papas ... Acaso se va a casar con ellos ? Basta y sobra con presentarles"
"1";"1228";"1";"779267716640417";"data";"data.*";"fetched (200)";"2023-09-25 21:40:56.842039";"Facebook:/<post-id>/comments";"";"Todo es la culpa de esa negra XD"
"1";"1229";"1";"779267716640417";"data";"data.*";"fetched (200)";"2023-09-25 21:40:56.842039";"Facebook:/<post-id>/comments";"";"Qué fuerte"
"1";"1230";"1";"779267716640417";"data";"data.*";"fetched (200)";"2023-09-25 21:40:56.842039";"Facebook:/<post-id>/comments";"";"Zzzzz"
"1";"1231";"1";"779267716640417";"data";"data.*";"fetched (200)";"2023-09-25 21:40:56.842039";"Facebook:/<post-id>/comments";"";"Pero que tales actores!!! Pucha están perdiendo plata y Michael Alexander contratando a Melissa Paredes 😂😂😂"
"1";"1232";"1";"779267716640417";"data";"data.*";"fetched (200)";"2023-09-25 21:40:56.842039";"Facebook:/<post-id>/comments";"";"Lo máximo el toyoo"
"1";"1233";"1";"779267716640417";"data";"data.*";"fetched (200)";"2023-09-25 21:40:56.842039";"Facebook:/<post-id>/comments";"";"No hay otro distrito que no sea mi callao 😭"
"1";"1234";"1";"779267716640417";"data";"data.*";"fetched (200)";"2023-09-25 21:40:56.842039";"Facebook:/<post-id>/comments";"";"A pero si fuera al revés"
"1";"1235";"1";"779267716640417";"data";"data.*";"fetched (200)";"2023-09-25 21:40:56.842039";"Facebook:/<post-id>/comments";"";"A mí me pasó anteayer x ser mádre soltera"
"1";"1236";"1";"779267716640417";"data";"data.*";"fetched (200)";"2023-09-25 21:40:56.842039";"Facebook:/<post-id>/comments";"";"El. Toyo es un actoraso"
"1";"1237";"1";"779267716640417";"data";"data.*";"fetched (200)";"2023-09-25 21:40:56.842039";"Facebook:/<post-id>/comments";"";"Jenyffer Herrera Barco ese Tato"
"1";"1238";"1";"779267716640417";"data";"data.*";"fetched (200)";"2023-09-25 21:40:56.842039";"Facebook:/<post-id>/comments";"";"Ya ve todo lo q ocasiona la uchulu"
"1";"1239";"1";"779267716640417";"data";"data.*";"fetched (200)";"2023-09-25 21:40:56.842039";"Facebook:/<post-id>/comments";"";"Damela ami esa negrita 🖤"
"1";"1240";"1";"779267716640417";"data";"data.*";"fetched (200)";"2023-09-25 21:40:56.842039";"Facebook:/<post-id>/comments";"";"Araceli T Espinoza xDxd Tu caso"
"1";"1241";"1";"779267716640417";"data";"data.*";"fetched (200)";"2023-09-25 21:40:56.842039";"Facebook:/<post-id>/comments";"";"Yo creo q también me metía jajajajaj"
"1";"1242";"1";"779267716640417";"data";"data.*";"fetched (200)";"2023-09-25 21:40:56.842039";"Facebook:/<post-id>/comments";"";"Qué buen experimento. 🔥💯💯"
"1";"1243";"1";"779267716640417";"data";"data.*";"fetched (200)";"2023-09-25 21:40:56.842039";"Facebook:/<post-id>/comments";"";"Xexdxdxx"
"1";"1244";"1";"779267716640417";"data";"data.*";"fetched (200)";"2023-09-25 21:40:56.842039";"Facebook:/<post-id>/comments";"";"Buena muchachos.  No al racismo"
"1";"1245";"1";"779267716640417";"data";"data.*";"fetched (200)";"2023-09-25 21:40:56.842039";"Facebook:/<post-id>/comments";"";"Fabricio Rojas Vivanco sólido.... Buenazo 🙌🏻 efectivamente es actuacion 🧐🚬🧐☕"
"1";"1246";"1";"779267716640417";"data";"data.*";"fetched (200)";"2023-09-25 21:40:56.842039";"Facebook:/<post-id>/comments";"";"Ivan Berru Zacarias  marca"
"1";"1247";"1";"779267716640417";"data";"data.*";"fetched (200)";"2023-09-25 21:40:56.842039";"Facebook:/<post-id>/comments";"";"Lo de LA mamá parece de verdad jajajajjaja creo que en su interior es racist4 digo no."
"1";"1248";"1";"779267716640417";"data";"data.*";"fetched (200)";"2023-09-25 21:40:56.842039";"Facebook:/<post-id>/comments";"";"Parece la esquina del barrio"
