"level";"id";"parent_id";"object_id";"object_type";"object_key";"query_status";"query_time";"query_type";"name";"message"
"1";"515";"1";"779267716640417";"data";"data.*";"fetched (200)";"2023-09-25 21:40:41.593031";"Facebook:/<post-id>/comments";"";"El oscar. para el toyo ."
"1";"516";"1";"779267716640417";"data";"data.*";"fetched (200)";"2023-09-25 21:40:41.593031";"Facebook:/<post-id>/comments";"";"Asoo les malograron el almuerzo, yo les hago pagar la cuenta! Si a mí me malograron el desayuno😔"
"1";"517";"1";"779267716640417";"data";"data.*";"fetched (200)";"2023-09-25 21:40:41.593031";"Facebook:/<post-id>/comments";"";"que  buena  .......hasta lo crei que era verdad......saludos"
"1";"518";"1";"779267716640417";"data";"data.*";"fetched (200)";"2023-09-25 21:40:41.593031";"Facebook:/<post-id>/comments";"";"Copia fiel"
"1";"519";"1";"779267716640417";"data";"data.*";"fetched (200)";"2023-09-25 21:40:41.593031";"Facebook:/<post-id>/comments";"";"Pura copia... De la tv española."
"1";"520";"1";"779267716640417";"data";"data.*";"fetched (200)";"2023-09-25 21:40:41.593031";"Facebook:/<post-id>/comments";"";"Tamare y la originalidad?"
"1";"521";"1";"779267716640417";"offcut";"";"fetched (200)";"2023-09-25 21:40:41.593031";"Facebook:/<post-id>/comments";"";""
"1";"522";"1";"779267716640417";"data";"data.*";"fetched (200)";"2023-09-25 21:40:42.224305";"Facebook:/<post-id>/comments";"";"Esto deberían dar en la  television no la.porqueria de ESTO ES GUERRA cambio radical en la televisión peruana por favor ..."
"1";"523";"1";"779267716640417";"data";"data.*";"fetched (200)";"2023-09-25 21:40:42.224305";"Facebook:/<post-id>/comments";"";"Jaja cómo que muy dramático, pero si me agrado ✅🔒"
"1";"524";"1";"779267716640417";"data";"data.*";"fetched (200)";"2023-09-25 21:40:42.224305";"Facebook:/<post-id>/comments";"";"Juntos podrían cantar eboly y Marfil 😸"
"1";"525";"1";"779267716640417";"data";"data.*";"fetched (200)";"2023-09-25 21:40:42.224305";"Facebook:/<post-id>/comments";"";"Quien xhucha es Ciccia? Toyo al Emmy!!!"
"1";"526";"1";"779267716640417";"data";"data.*";"fetched (200)";"2023-09-25 21:40:42.224305";"Facebook:/<post-id>/comments";"";"Eso lo ví en España"
"1";"527";"1";"779267716640417";"data";"data.*";"fetched (200)";"2023-09-25 21:40:42.224305";"Facebook:/<post-id>/comments";"";"Se pasaron estos conches . Ke  buenasa"
"1";"528";"1";"779267716640417";"data";"data.*";"fetched (200)";"2023-09-25 21:40:42.224305";"Facebook:/<post-id>/comments";"";"Q horrible actuación  de ese hombre"
"1";"529";"1";"779267716640417";"data";"data.*";"fetched (200)";"2023-09-25 21:40:42.224305";"Facebook:/<post-id>/comments";"";"Parecía tan real que me la estaba creyendo en serio. Un Oscar para los padres jajaja"
"1";"530";"1";"779267716640417";"data";"data.*";"fetched (200)";"2023-09-25 21:40:42.224305";"Facebook:/<post-id>/comments";"";"Es curioso que las únicas personas que defendieron a la chica fueron ""mujeres"" 👀"
"1";"531";"1";"779267716640417";"data";"data.*";"fetched (200)";"2023-09-25 21:40:42.224305";"Facebook:/<post-id>/comments";"";"Muy bueno"
"1";"532";"1";"779267716640417";"data";"data.*";"fetched (200)";"2023-09-25 21:40:42.224305";"Facebook:/<post-id>/comments";"";"Estoy son unos con..."
"1";"533";"1";"779267716640417";"data";"data.*";"fetched (200)";"2023-09-25 21:40:42.224305";"Facebook:/<post-id>/comments";"";"Que vwrg xd"
"1";"534";"1";"779267716640417";"data";"data.*";"fetched (200)";"2023-09-25 21:40:42.224305";"Facebook:/<post-id>/comments";"";"Venti ahora eres actor???"
"1";"535";"1";"779267716640417";"data";"data.*";"fetched (200)";"2023-09-25 21:40:42.224305";"Facebook:/<post-id>/comments";"";"Yo por essa peluca del señor ya hubiera sospechado algo raro😂"
"1";"536";"1";"779267716640417";"data";"data.*";"fetched (200)";"2023-09-25 21:40:42.224305";"Facebook:/<post-id>/comments";"";"Estos casos son reales y suceden siempre en el mundo..porque??"
"1";"537";"1";"779267716640417";"data";"data.*";"fetched (200)";"2023-09-25 21:40:42.224305";"Facebook:/<post-id>/comments";"";"Vladimir Yucra color económico xd"
"1";"538";"1";"779267716640417";"data";"data.*";"fetched (200)";"2023-09-25 21:40:42.224305";"Facebook:/<post-id>/comments";"";"El Toyo es Billy Joel o Rick Harrison?"
"1";"539";"1";"779267716640417";"data";"data.*";"fetched (200)";"2023-09-25 21:40:42.224305";"Facebook:/<post-id>/comments";"";"Buena la actuacion de la mamá, parece tan real..."
"1";"540";"1";"779267716640417";"data";"data.*";"fetched (200)";"2023-09-25 21:40:42.224305";"Facebook:/<post-id>/comments";"";"Aldair Ponce mira a tu causa recurseandose jajaja"
"1";"541";"1";"779267716640417";"data";"data.*";"fetched (200)";"2023-09-25 21:40:42.224305";"Facebook:/<post-id>/comments";"";"Que ridículos son😅"
"1";"542";"1";"779267716640417";"data";"data.*";"fetched (200)";"2023-09-25 21:40:42.224305";"Facebook:/<post-id>/comments";"";"Ingrid Benites Rondón mira hasta el final cuando dice: todo lo que te hemos dicho es mentira jajajajaajajaja xd"
"1";"543";"1";"779267716640417";"data";"data.*";"fetched (200)";"2023-09-25 21:40:42.224305";"Facebook:/<post-id>/comments";"";"Yo pensé q era Rosangela bárbaran 🤣🤣🤣"
"1";"544";"1";"779267716640417";"data";"data.*";"fetched (200)";"2023-09-25 21:40:42.224305";"Facebook:/<post-id>/comments";"";"Waooo.. Creo que yooo. Le hubiera dado una cachetadaaa. A este viejooo..🤭..."
"1";"545";"1";"779267716640417";"data";"data.*";"fetched (200)";"2023-09-25 21:40:42.224305";"Facebook:/<post-id>/comments";"";"La bajan bien jakakakaka"
"1";"546";"1";"779267716640417";"data";"data.*";"fetched (200)";"2023-09-25 21:40:42.224305";"Facebook:/<post-id>/comments";"";"Kajajajajajjajaajjajaja"
"1";"547";"1";"779267716640417";"offcut";"";"fetched (200)";"2023-09-25 21:40:42.224305";"Facebook:/<post-id>/comments";"";""
"1";"548";"1";"779267716640417";"data";"data.*";"fetched (200)";"2023-09-25 21:40:42.738860";"Facebook:/<post-id>/comments";"";"Que Buena Toyin!!"
"1";"549";"1";"779267716640417";"data";"data.*";"fetched (200)";"2023-09-25 21:40:42.738860";"Facebook:/<post-id>/comments";"";"Eso es real o es actuación?"
"1";"550";"1";"779267716640417";"data";"data.*";"fetched (200)";"2023-09-25 21:40:42.738860";"Facebook:/<post-id>/comments";"";"Jajajajajjaja q kge de richard"
"1";"551";"1";"779267716640417";"data";"data.*";"fetched (200)";"2023-09-25 21:40:42.738860";"Facebook:/<post-id>/comments";"";"Karen RiveraKyara Ventocilla Collado opiniones"
"1";"552";"1";"779267716640417";"data";"data.*";"fetched (200)";"2023-09-25 21:40:42.738860";"Facebook:/<post-id>/comments";"";"Me da risa cuando se pone su lentes la verdad la discriminación nunca va acabar nunca"
"1";"553";"1";"779267716640417";"data";"data.*";"fetched (200)";"2023-09-25 21:40:42.738860";"Facebook:/<post-id>/comments";"";"bien toyito y damian"
"1";"554";"1";"779267716640417";"data";"data.*";"fetched (200)";"2023-09-25 21:40:42.738860";"Facebook:/<post-id>/comments";"";"Jajajajaja mi hizo el día 😂😂😂😂"
"1";"555";"1";"779267716640417";"data";"data.*";"fetched (200)";"2023-09-25 21:40:42.738860";"Facebook:/<post-id>/comments";"";"Lilihan tus preferidos ‘n"
"1";"556";"1";"779267716640417";"data";"data.*";"fetched (200)";"2023-09-25 21:40:42.738860";"Facebook:/<post-id>/comments";"";"La verdad Damián eres un mate de risa"
"1";"557";"1";"779267716640417";"data";"data.*";"fetched (200)";"2023-09-25 21:40:42.738860";"Facebook:/<post-id>/comments";"";"Era necesario esto?"
"1";"558";"1";"779267716640417";"data";"data.*";"fetched (200)";"2023-09-25 21:40:42.738860";"Facebook:/<post-id>/comments";"";"El mesero el único heroe hombre"
"1";"559";"1";"779267716640417";"data";"data.*";"fetched (200)";"2023-09-25 21:40:42.738860";"Facebook:/<post-id>/comments";"";"Pensaba que me venía atender frío jajaja XD"
"1";"560";"1";"779267716640417";"data";"data.*";"fetched (200)";"2023-09-25 21:40:42.738860";"Facebook:/<post-id>/comments";"";"CF Liam Cali jajajjaa mori😂😂🤗"
"1";"561";"1";"779267716640417";"data";"data.*";"fetched (200)";"2023-09-25 21:40:42.738860";"Facebook:/<post-id>/comments";"";"Mi chófer 🤣🤣🤣🤣"
"1";"562";"1";"779267716640417";"data";"data.*";"fetched (200)";"2023-09-25 21:40:42.738860";"Facebook:/<post-id>/comments";"";"Pienso q todos son cómplices,  porq si fuera de verdad ya le hubieran sacado la csm al señor jajajjaja"
"1";"563";"1";"779267716640417";"data";"data.*";"fetched (200)";"2023-09-25 21:40:42.738860";"Facebook:/<post-id>/comments";"";"Nélyda GM  estos se pasaron 😂"
"1";"564";"1";"779267716640417";"data";"data.*";"fetched (200)";"2023-09-25 21:40:42.738860";"Facebook:/<post-id>/comments";"";"El Toyo no es Billy Joel?"
"1";"565";"1";"779267716640417";"data";"data.*";"fetched (200)";"2023-09-25 21:40:42.738860";"Facebook:/<post-id>/comments";"";"Andy E. Otero  exceso de cine papi!"
"1";"566";"1";"779267716640417";"data";"data.*";"fetched (200)";"2023-09-25 21:40:42.738860";"Facebook:/<post-id>/comments";"";"No me párese gracioso  🤔😒"
"1";"567";"1";"779267716640417";"data";"data.*";"fetched (200)";"2023-09-25 21:40:42.738860";"Facebook:/<post-id>/comments";"";"Jajajajajajajjaa actorazoooo"
"1";"568";"1";"779267716640417";"data";"data.*";"fetched (200)";"2023-09-25 21:40:42.738860";"Facebook:/<post-id>/comments";"";"Dennis Morey  jjjajaajaj cage de risa"
"1";"569";"1";"779267716640417";"data";"data.*";"fetched (200)";"2023-09-25 21:40:42.738860";"Facebook:/<post-id>/comments";"";"Cague de risha el Toyo tmr 🤣🤣🤣"
"1";"570";"1";"779267716640417";"data";"data.*";"fetched (200)";"2023-09-25 21:40:42.738860";"Facebook:/<post-id>/comments";"";"Y por que siempre tiene que ser la, novia... desde el, inicio. Es ?????"
"1";"571";"1";"779267716640417";"data";"data.*";"fetched (200)";"2023-09-25 21:40:42.738860";"Facebook:/<post-id>/comments";"";"Buena actuación de María del Carmen Alva y la Barbarán 😆"
"1";"572";"1";"779267716640417";"data";"data.*";"fetched (200)";"2023-09-25 21:40:42.738860";"Facebook:/<post-id>/comments";"";"Jajajajaj csmmmm Buenasaaa"
"1";"573";"1";"779267716640417";"offcut";"";"fetched (200)";"2023-09-25 21:40:42.738860";"Facebook:/<post-id>/comments";"";""
"1";"574";"1";"779267716640417";"data";"data.*";"fetched (200)";"2023-09-25 21:40:43.213490";"Facebook:/<post-id>/comments";"";"Un aplauso para el toyo  Se merece 5 oscar"
"1";"575";"1";"779267716640417";"data";"data.*";"fetched (200)";"2023-09-25 21:40:43.213490";"Facebook:/<post-id>/comments";"";"Ya veo la rosa de guadalupe...soplando al señor"
"1";"576";"1";"779267716640417";"data";"data.*";"fetched (200)";"2023-09-25 21:40:43.213490";"Facebook:/<post-id>/comments";"";"Roberto Lara hasta yo lo creí 🤣😸🤣"
"1";"577";"1";"779267716640417";"data";"data.*";"fetched (200)";"2023-09-25 21:40:43.213490";"Facebook:/<post-id>/comments";"";"Definitivamente esto es cine señores 🚬 , denle un osar a Toyin por esa gran actuación 👏 , Giovani Ciccia es un toffi de 20 a la lado del gran Toyo crj 👏"
"1";"578";"1";"779267716640417";"data";"data.*";"fetched (200)";"2023-09-25 21:40:43.213490";"Facebook:/<post-id>/comments";"";"Que pasó con el Carmen de chincha alta faltando 1 minuto 15 segundos para terminar."
"1";"579";"1";"779267716640417";"data";"data.*";"fetched (200)";"2023-09-25 21:40:43.213490";"Facebook:/<post-id>/comments";"";"Damian y el Toyo, no se mueran nunca, son lo mejor del Perú, excelente amigos, son lo máximo"
"1";"580";"1";"779267716640417";"data";"data.*";"fetched (200)";"2023-09-25 21:40:43.213490";"Facebook:/<post-id>/comments";"";"Xddd"
"1";"581";"1";"779267716640417";"data";"data.*";"fetched (200)";"2023-09-25 21:40:43.213490";"Facebook:/<post-id>/comments";"";"Que fue con Venti"
"1";"582";"1";"779267716640417";"data";"data.*";"fetched (200)";"2023-09-25 21:40:43.213490";"Facebook:/<post-id>/comments";"";"Q cagada..."
"1";"583";"1";"779267716640417";"data";"data.*";"fetched (200)";"2023-09-25 21:40:43.213490";"Facebook:/<post-id>/comments";"";"Todos cuando se desmayo , que se muera ese viejo xD ,"
"1";"584";"1";"779267716640417";"data";"data.*";"fetched (200)";"2023-09-25 21:40:43.213490";"Facebook:/<post-id>/comments";"";"Ni la Rosa de Guadalupe se atrevió a tanto!"
"1";"585";"1";"779267716640417";"data";"data.*";"fetched (200)";"2023-09-25 21:40:43.213490";"Facebook:/<post-id>/comments";"";"Jaja q imbec..."
"1";"586";"1";"779267716640417";"data";"data.*";"fetched (200)";"2023-09-25 21:40:43.213490";"Facebook:/<post-id>/comments";"";"¡A la mrd que bien actúan!"
"1";"587";"1";"779267716640417";"data";"data.*";"fetched (200)";"2023-09-25 21:40:43.213490";"Facebook:/<post-id>/comments";"";"Que paso con su canal de youtube?"
"1";"588";"1";"779267716640417";"data";"data.*";"fetched (200)";"2023-09-25 21:40:43.213490";"Facebook:/<post-id>/comments";"";"Bueenaaaaaaaaaa"
"1";"589";"1";"779267716640417";"data";"data.*";"fetched (200)";"2023-09-25 21:40:43.213490";"Facebook:/<post-id>/comments";"";"Ese Toyo👏 es un buen actor 🤣🤣"
"1";"590";"1";"779267716640417";"data";"data.*";"fetched (200)";"2023-09-25 21:40:43.213490";"Facebook:/<post-id>/comments";"";"Jajjaja asu mare llego un punto q se descontroló todo jajjaaj"
"1";"591";"1";"779267716640417";"data";"data.*";"fetched (200)";"2023-09-25 21:40:43.213490";"Facebook:/<post-id>/comments";"";"Quien te conoce, Giovani ciccia"
"1";"592";"1";"779267716640417";"data";"data.*";"fetched (200)";"2023-09-25 21:40:43.213490";"Facebook:/<post-id>/comments";"";"La idea era que lo actuen no que sea tan real xd"
"1";"593";"1";"779267716640417";"data";"data.*";"fetched (200)";"2023-09-25 21:40:43.213490";"Facebook:/<post-id>/comments";"";"Jajajajaja qtcsm"
"1";"594";"1";"779267716640417";"data";"data.*";"fetched (200)";"2023-09-25 21:40:43.213490";"Facebook:/<post-id>/comments";"";"Por un momento pensé que ya se habían salido del guión 😅"
"1";"595";"1";"779267716640417";"data";"data.*";"fetched (200)";"2023-09-25 21:40:43.213490";"Facebook:/<post-id>/comments";"";"Buena jaze!!"
"1";"596";"1";"779267716640417";"data";"data.*";"fetched (200)";"2023-09-25 21:40:43.213490";"Facebook:/<post-id>/comments";"";"JAJAJA ayyyyyyyyyy se me hacen conocidos"
"1";"597";"1";"779267716640417";"data";"data.*";"fetched (200)";"2023-09-25 21:40:43.213490";"Facebook:/<post-id>/comments";"";"Jajajaja csmr se cae  nadie para bola"
"1";"598";"1";"779267716640417";"data";"data.*";"fetched (200)";"2023-09-25 21:40:43.213490";"Facebook:/<post-id>/comments";"";"Ese peluquin mas falso si yo lo veo empiezo a dudar que algo pasa"
"1";"599";"1";"779267716640417";"offcut";"";"fetched (200)";"2023-09-25 21:40:43.213490";"Facebook:/<post-id>/comments";"";""
"1";"600";"1";"779267716640417";"data";"data.*";"fetched (200)";"2023-09-25 21:40:43.864889";"Facebook:/<post-id>/comments";"";"Los Maldini y los Gonzales xD"
"1";"601";"1";"779267716640417";"data";"data.*";"fetched (200)";"2023-09-25 21:40:43.864889";"Facebook:/<post-id>/comments";"";"Ese Montalván xd"
"1";"602";"1";"779267716640417";"data";"data.*";"fetched (200)";"2023-09-25 21:40:43.864889";"Facebook:/<post-id>/comments";"";"La mamá parecía real más que actuación."
"1";"603";"1";"779267716640417";"data";"data.*";"fetched (200)";"2023-09-25 21:40:43.864889";"Facebook:/<post-id>/comments";"";"Jajajajaja ptmr 😂"
"1";"604";"1";"779267716640417";"data";"data.*";"fetched (200)";"2023-09-25 21:40:43.864889";"Facebook:/<post-id>/comments";"";"No se dan cuenta publico ciego q este toyo viejo  No hace mas q incentivar el racismo en nuestro pais Y no me digan q es una broma xq hay bromas y bromas Nunca me cayo este tipo mal educado aspero vulgar toyo viejo"
"1";"605";"1";"779267716640417";"data";"data.*";"fetched (200)";"2023-09-25 21:40:43.864889";"Facebook:/<post-id>/comments";"";"Anny Cr tu caso pero al revés 😅😅😂😂🤣"
"1";"606";"1";"779267716640417";"data";"data.*";"fetched (200)";"2023-09-25 21:40:43.864889";"Facebook:/<post-id>/comments";"";"Ese papá es tan cardíaco..😂😂"
"1";"607";"1";"779267716640417";"data";"data.*";"fetched (200)";"2023-09-25 21:40:43.864889";"Facebook:/<post-id>/comments";"";"Jajajaja parece el congreso"
"1";"608";"1";"779267716640417";"data";"data.*";"fetched (200)";"2023-09-25 21:40:43.864889";"Facebook:/<post-id>/comments";"";"Jajaja oeee 🤣"
"1";"609";"1";"779267716640417";"data";"data.*";"fetched (200)";"2023-09-25 21:40:43.864889";"Facebook:/<post-id>/comments";"";"Jajaja tmr que rica actuacion xd no como mi ex que ni actuar sabia y se hacia la vistima xD"
"1";"610";"1";"779267716640417";"data";"data.*";"fetched (200)";"2023-09-25 21:40:43.864889";"Facebook:/<post-id>/comments";"";"Ese no es el venti el rapero?"
"1";"611";"1";"779267716640417";"data";"data.*";"fetched (200)";"2023-09-25 21:40:43.864889";"Facebook:/<post-id>/comments";"";"""va a desheredar""...."
"1";"612";"1";"779267716640417";"data";"data.*";"fetched (200)";"2023-09-25 21:40:43.864889";"Facebook:/<post-id>/comments";"";"Es la triste realidad"
"1";"613";"1";"779267716640417";"data";"data.*";"fetched (200)";"2023-09-25 21:40:43.864889";"Facebook:/<post-id>/comments";"";"La morena..esta hermosa..muy linda"
"1";"614";"1";"779267716640417";"data";"data.*";"fetched (200)";"2023-09-25 21:40:43.864889";"Facebook:/<post-id>/comments";"";"El show era sin gritar"
"1";"615";"1";"779267716640417";"data";"data.*";"fetched (200)";"2023-09-25 21:40:43.864889";"Facebook:/<post-id>/comments";"";"🤡🤡🤡🤡 Yo si le hubiera metido un golpe al viejo en one"
"1";"616";"1";"779267716640417";"data";"data.*";"fetched (200)";"2023-09-25 21:40:43.864889";"Facebook:/<post-id>/comments";"";"Fue espectacular 🙌🏻🙌🏻🙌🏻🙌🏻 magnífica actuación 🤝🤝🤝🤝"
"1";"617";"1";"779267716640417";"data";"data.*";"fetched (200)";"2023-09-25 21:40:43.864889";"Facebook:/<post-id>/comments";"";"Kiara Orm muy bien amiga!"
"1";"618";"1";"779267716640417";"data";"data.*";"fetched (200)";"2023-09-25 21:40:43.864889";"Facebook:/<post-id>/comments";"";"Victor Manuel  Y tú vendiendome en Ebay"
"1";"619";"1";"779267716640417";"data";"data.*";"fetched (200)";"2023-09-25 21:40:43.864889";"Facebook:/<post-id>/comments";"";"Ese toyo"
"1";"620";"1";"779267716640417";"data";"data.*";"fetched (200)";"2023-09-25 21:40:43.864889";"Facebook:/<post-id>/comments";"";"Alcalde de Chincha🤣"
"1";"621";"1";"779267716640417";"data";"data.*";"fetched (200)";"2023-09-25 21:40:43.864889";"Facebook:/<post-id>/comments";"";"Jajaja la tía no llames no llames 🤣🤣🤣"
"1";"622";"1";"779267716640417";"data";"data.*";"fetched (200)";"2023-09-25 21:40:43.864889";"Facebook:/<post-id>/comments";"";"Ese toyo es un xuxa 🤣🤣🤣"
"1";"623";"1";"779267716640417";"data";"data.*";"fetched (200)";"2023-09-25 21:40:43.864889";"Facebook:/<post-id>/comments";"";"Todo Armani. Los lápices creen todo."
"1";"624";"1";"779267716640417";"data";"data.*";"fetched (200)";"2023-09-25 21:40:43.864889";"Facebook:/<post-id>/comments";"";"literal asi son los tios blancos de Lima 🤣🤣😅"
"1";"625";"1";"779267716640417";"offcut";"";"fetched (200)";"2023-09-25 21:40:43.864889";"Facebook:/<post-id>/comments";"";""
"1";"626";"1";"779267716640417";"data";"data.*";"fetched (200)";"2023-09-25 21:40:44.355002";"Facebook:/<post-id>/comments";"";"Venti tmb era actor ?"
"1";"627";"1";"779267716640417";"data";"data.*";"fetched (200)";"2023-09-25 21:40:44.355002";"Facebook:/<post-id>/comments";"";"El Toyo es un csmre jajajajajaaja"
"1";"628";"1";"779267716640417";"data";"data.*";"fetched (200)";"2023-09-25 21:40:44.355002";"Facebook:/<post-id>/comments";"";"Leo Mo Laf  esto es actuación no ta basura de al fondo hay sitio que tanto vez xd"
"1";"629";"1";"779267716640417";"data";"data.*";"fetched (200)";"2023-09-25 21:40:44.355002";"Facebook:/<post-id>/comments";"";"Jajajajajajajaja toyo la cagada jajajaja denle algo como premio pero me cage de risa"
"1";"630";"1";"779267716640417";"data";"data.*";"fetched (200)";"2023-09-25 21:40:44.355002";"Facebook:/<post-id>/comments";"";"Ese no es venti?"
"1";"631";"1";"779267716640417";"data";"data.*";"fetched (200)";"2023-09-25 21:40:44.355002";"Facebook:/<post-id>/comments";"";"Jaja son racista y los 3 toman coca cola, se que es un swou solo digo"
"1";"632";"1";"779267716640417";"data";"data.*";"fetched (200)";"2023-09-25 21:40:44.355002";"Facebook:/<post-id>/comments";"";"Si toyo la pegaste bien de come caca (loco)  jajajajaaj"
"1";"633";"1";"779267716640417";"data";"data.*";"fetched (200)";"2023-09-25 21:40:44.355002";"Facebook:/<post-id>/comments";"";"Buenazo, demasiado creíble, los papás le ganaron a todos los actores del canal 4"
"1";"634";"1";"779267716640417";"data";"data.*";"fetched (200)";"2023-09-25 21:40:44.355002";"Facebook:/<post-id>/comments";"";"Todo un show para que no recompensen a los héroes que verguenza"
"1";"635";"1";"779267716640417";"data";"data.*";"fetched (200)";"2023-09-25 21:40:44.355002";"Facebook:/<post-id>/comments";"";"Ese tio en drogas"
"1";"636";"1";"779267716640417";"data";"data.*";"fetched (200)";"2023-09-25 21:40:44.355002";"Facebook:/<post-id>/comments";"";"La canela xd"
"1";"637";"1";"779267716640417";"data";"data.*";"fetched (200)";"2023-09-25 21:40:44.355002";"Facebook:/<post-id>/comments";"";"El Toyo es un LOCAZO, JAJAJAJAJAJAJAAJ"
"1";"638";"1";"779267716640417";"data";"data.*";"fetched (200)";"2023-09-25 21:40:44.355002";"Facebook:/<post-id>/comments";"";"Milton Huachillo Cotrina  se paresce alguien amor jajajaj"
"1";"639";"1";"779267716640417";"data";"data.*";"fetched (200)";"2023-09-25 21:40:44.355002";"Facebook:/<post-id>/comments";"";"No hay x que compararse de nada ni nadie, ni x el color de piel ni de apellido ni nada Todos somos hijos de Dios"
"1";"640";"1";"779267716640417";"data";"data.*";"fetched (200)";"2023-09-25 21:40:44.355002";"Facebook:/<post-id>/comments";"";"Esa voz del viejo como que se me hace conocido ...""cayate la boca"" "" cayate la boca"""
"1";"641";"1";"779267716640417";"data";"data.*";"fetched (200)";"2023-09-25 21:40:44.355002";"Facebook:/<post-id>/comments";"";"Buena ventó jaa"
"1";"642";"1";"779267716640417";"data";"data.*";"fetched (200)";"2023-09-25 21:40:44.355002";"Facebook:/<post-id>/comments";"";"No sabia que seguían vivos,aun puedo mandar mi broma? aua xD"
"1";"643";"1";"779267716640417";"data";"data.*";"fetched (200)";"2023-09-25 21:40:44.355002";"Facebook:/<post-id>/comments";"";"La actuación de Malcriada del Carmen, impecable como siempre."
"1";"644";"1";"779267716640417";"data";"data.*";"fetched (200)";"2023-09-25 21:40:44.355002";"Facebook:/<post-id>/comments";"";"Kiara Orm amigaaaa 🤭"
"1";"645";"1";"779267716640417";"data";"data.*";"fetched (200)";"2023-09-25 21:40:44.355002";"Facebook:/<post-id>/comments";"";"Nana Paw  ésto es Cine xdhh"
"1";"646";"1";"779267716640417";"data";"data.*";"fetched (200)";"2023-09-25 21:40:44.355002";"Facebook:/<post-id>/comments";"";"Buena muy buena ... actorazo el toyo jaja"
"1";"647";"1";"779267716640417";"data";"data.*";"fetched (200)";"2023-09-25 21:40:44.355002";"Facebook:/<post-id>/comments";"";"Mary Moreno André Bustamante Vasquez tenemos que ver éste programa por favor jajajaa"
"1";"648";"1";"779267716640417";"data";"data.*";"fetched (200)";"2023-09-25 21:40:44.355002";"Facebook:/<post-id>/comments";"";"Tmr por qué callao :V tmr uu yo vivo ahí pipi"
"1";"649";"1";"779267716640417";"data";"data.*";"fetched (200)";"2023-09-25 21:40:44.355002";"Facebook:/<post-id>/comments";"";"Ni un hombre se paro, jajajja pintados los hueeee..."
"1";"650";"1";"779267716640417";"data";"data.*";"fetched (200)";"2023-09-25 21:40:44.355002";"Facebook:/<post-id>/comments";"";"Si nunca as trabajado jxjxjxjx"
"1";"651";"1";"779267716640417";"offcut";"";"fetched (200)";"2023-09-25 21:40:44.355002";"Facebook:/<post-id>/comments";"";""
"1";"652";"1";"779267716640417";"data";"data.*";"fetched (200)";"2023-09-25 21:40:44.887537";"Facebook:/<post-id>/comments";"";"Jajaja me iso el dia cage de richard"
"1";"653";"1";"779267716640417";"data";"data.*";"fetched (200)";"2023-09-25 21:40:44.887537";"Facebook:/<post-id>/comments";"";"Boris Silva oe khaaa"
"1";"654";"1";"779267716640417";"data";"data.*";"fetched (200)";"2023-09-25 21:40:44.887537";"Facebook:/<post-id>/comments";"";"venti? qué haces ahí ? esa no es tu familia.XD"
"1";"655";"1";"779267716640417";"data";"data.*";"fetched (200)";"2023-09-25 21:40:44.887537";"Facebook:/<post-id>/comments";"";"Jhosselyn Alarcón checa esta joyita"
"1";"656";"1";"779267716640417";"data";"data.*";"fetched (200)";"2023-09-25 21:40:44.887537";"Facebook:/<post-id>/comments";"";"Pensé que venía a atenderme no a casarse con mi hijo * AJSJAJAJAJAJAJ"
"1";"657";"1";"779267716640417";"data";"data.*";"fetched (200)";"2023-09-25 21:40:44.887537";"Facebook:/<post-id>/comments";"";"ese venti xd"
"1";"658";"1";"779267716640417";"data";"data.*";"fetched (200)";"2023-09-25 21:40:44.887537";"Facebook:/<post-id>/comments";"";"La mamá estaba actuando jajajaa xd"
"1";"659";"1";"779267716640417";"data";"data.*";"fetched (200)";"2023-09-25 21:40:44.887537";"Facebook:/<post-id>/comments";"";"Lo está tomando en serío ese top show"
"1";"660";"1";"779267716640417";"data";"data.*";"fetched (200)";"2023-09-25 21:40:44.887537";"Facebook:/<post-id>/comments";"";"Luis Fernando Alvarez que frios son esos csmre 🤣🤣🤣"
"1";"661";"1";"779267716640417";"data";"data.*";"fetched (200)";"2023-09-25 21:40:44.887537";"Facebook:/<post-id>/comments";"";"Me sorprendió la actuación bienn"
"1";"662";"1";"779267716640417";"data";"data.*";"fetched (200)";"2023-09-25 21:40:44.887537";"Facebook:/<post-id>/comments";"";"Damián es el mejor ☺️🙌🙌🙌🙌"
"1";"663";"1";"779267716640417";"data";"data.*";"fetched (200)";"2023-09-25 21:40:44.887537";"Facebook:/<post-id>/comments";"";"Francis Angelo Orbezo Lecca no lo sé Rick parece verdadero"
