"level";"id";"parent_id";"object_id";"object_type";"object_key";"query_status";"query_time";"query_type";"name";"message"
"1";"749";"1";"212913106619453";"data";"data.*";"fetched (200)";"2023-10-01 11:32:01.929111";"Facebook:/<post-id>/comments";"";"Ana Claudia no te andes chapando cualquier huevada ..esto aplica también sin corona virus 😂😂😂"
"1";"750";"1";"212913106619453";"data";"data.*";"fetched (200)";"2023-10-01 11:32:01.929111";"Facebook:/<post-id>/comments";"";":v Lo malo es que usó chistes reciclados como lo de AL y la mascarilla"
"1";"751";"1";"212913106619453";"data";"data.*";"fetched (200)";"2023-10-01 11:32:01.929111";"Facebook:/<post-id>/comments";"";"Mascarilla ahora esta Mascarilla???...ese chiste fue un meme, no tienes talento, aceptalo."
"1";"752";"1";"212913106619453";"data";"data.*";"fetched (200)";"2023-10-01 11:32:01.929111";"Facebook:/<post-id>/comments";"";"Esta ves si se esforzo jajajaja buena la de alianza lima jaja"
"1";"753";"1";"212913106619453";"data";"data.*";"fetched (200)";"2023-10-01 11:32:01.929111";"Facebook:/<post-id>/comments";"";"Mas dio risa lo que la flaca dice que todo su monologo"
"1";"754";"1";"212913106619453";"data";"data.*";"fetched (200)";"2023-10-01 11:32:01.929111";"Facebook:/<post-id>/comments";"";"Que xuxa tiene este mongzZzZzZz"
"1";"755";"1";"212913106619453";"offcut";"";"fetched (200)";"2023-10-01 11:32:01.929111";"Facebook:/<post-id>/comments";"";""
"1";"756";"1";"212913106619453";"data";"data.*";"fetched (200)";"2023-10-01 11:32:02.249530";"Facebook:/<post-id>/comments";"";"Es la primera vez que sonrió con uno de tus videos “pagados o no”   Pd. Ya me dio sueño (qué no se pierdan las costumbres) :v "
"1";"757";"1";"212913106619453";"data";"data.*";"fetched (200)";"2023-10-01 11:32:02.249530";"Facebook:/<post-id>/comments";"";"El chiste viene por separado?"
"1";"758";"1";"212913106619453";"data";"data.*";"fetched (200)";"2023-10-01 11:32:02.249530";"Facebook:/<post-id>/comments";"";"Mis sobrinos por ver tu video se quedaron jatazo y no avanzaron su tarea, tamare la cagas oe"
"1";"759";"1";"212913106619453";"data";"data.*";"fetched (200)";"2023-10-01 11:32:02.249530";"Facebook:/<post-id>/comments";"";"Aea y a qué hora el chiste, lo descargo aparte o qué? 😒"
"1";"760";"1";"212913106619453";"data";"data.*";"fetched (200)";"2023-10-01 11:32:02.249530";"Facebook:/<post-id>/comments";"";"Defensas ultra bajas jajajajajajaja tan bajas que en 10 segundos te matan jajajajajajaja "
"1";"761";"1";"212913106619453";"data";"data.*";"fetched (200)";"2023-10-01 11:32:02.249530";"Facebook:/<post-id>/comments";"";"Jajajaja amé este video... ""Es como una historia de peluchín"" jajaja"
"1";"762";"1";"212913106619453";"data";"data.*";"fetched (200)";"2023-10-01 11:32:02.249530";"Facebook:/<post-id>/comments";"";"Zzz zzz no llegue mi al segundo 5 y me quede jato"
"1";"763";"1";"212913106619453";"data";"data.*";"fetched (200)";"2023-10-01 11:32:02.249530";"Facebook:/<post-id>/comments";"";"No se porque lo joden de que aburre, si es algo chistoso creo"
"1";"764";"1";"212913106619453";"data";"data.*";"fetched (200)";"2023-10-01 11:32:02.249530";"Facebook:/<post-id>/comments";"";"Anda con mascarilla tu puedes sobrevivír al corona virus pero  tus niños y tus avuelos corren riesgo. No te alarmen solo es tratar de prevenir"
"1";"765";"1";"212913106619453";"data";"data.*";"fetched (200)";"2023-10-01 11:32:02.249530";"Facebook:/<post-id>/comments";"";"Poco a poco vas mejorando 😂  Ya haces reír un poco más 😂"
"1";"766";"1";"212913106619453";"data";"data.*";"fetched (200)";"2023-10-01 11:32:02.249530";"Facebook:/<post-id>/comments";"";"Todo bien hasta que te metiste con mi Alianza conchatuzzzzzzzzzzz"
"1";"767";"1";"212913106619453";"data";"data.*";"fetched (200)";"2023-10-01 11:32:02.249530";"Facebook:/<post-id>/comments";"";"oe si da risa cmsre. M siento estofado"
"1";"768";"1";"212913106619453";"data";"data.*";"fetched (200)";"2023-10-01 11:32:02.249530";"Facebook:/<post-id>/comments";"";"Le di click motivado a reírme y me dio sueño."
"1";"769";"1";"212913106619453";"data";"data.*";"fetched (200)";"2023-10-01 11:32:02.249530";"Facebook:/<post-id>/comments";"";"Jajaja más carilla. Qué bue... 💤 💤 💤 zzzzz"
"1";"770";"1";"212913106619453";"data";"data.*";"fetched (200)";"2023-10-01 11:32:02.249530";"Facebook:/<post-id>/comments";"";"Mateo! Te faltó el hashtag #NoSeDuermaPoFaVo!"
"1";"771";"1";"212913106619453";"data";"data.*";"fetched (200)";"2023-10-01 11:32:02.249530";"Facebook:/<post-id>/comments";"";"No vi el video Vine directo a los comentarios :v "
"1";"772";"1";"212913106619453";"data";"data.*";"fetched (200)";"2023-10-01 11:32:02.249530";"Facebook:/<post-id>/comments";"";"Déjense de huevadas,  si dio risa"
"1";"773";"1";"212913106619453";"data";"data.*";"fetched (200)";"2023-10-01 11:32:02.249530";"Facebook:/<post-id>/comments";"";"Por favor datos de tu show, para perdérmelo sin falta  Sacar chiste de todos los memes del corona y hacer un video, aea mongol.   Zzzzzzzzzzz"
"1";"774";"1";"212913106619453";"data";"data.*";"fetched (200)";"2023-10-01 11:32:02.249530";"Facebook:/<post-id>/comments";"";"Hasta Los Memes del Coronavirus da mas risa q tu Video... zZzzZz"
"1";"775";"1";"212913106619453";"data";"data.*";"fetched (200)";"2023-10-01 11:32:02.249530";"Facebook:/<post-id>/comments";"";"Lo mejor del video , los comentarios"
"1";"776";"1";"212913106619453";"data";"data.*";"fetched (200)";"2023-10-01 11:32:02.249530";"Facebook:/<post-id>/comments";"";"Gracias por los consejos Mateo eres el mejorzzzzzzzzzzzz"
"1";"777";"1";"212913106619453";"data";"data.*";"fetched (200)";"2023-10-01 11:32:02.249530";"Facebook:/<post-id>/comments";"";"Me he cagado de risa, y ni si quiera miré el video. 🥑"
"1";"778";"1";"212913106619453";"data";"data.*";"fetched (200)";"2023-10-01 11:32:02.249530";"Facebook:/<post-id>/comments";"";"Mateoooo ay lov yu!!!!"
"1";"779";"1";"212913106619453";"data";"data.*";"fetched (200)";"2023-10-01 11:32:02.249530";"Facebook:/<post-id>/comments";"";"HAHAHAHAHAHAHAHAHHA yo quiero una mascarilla Para tapar mi cara xdxd "
"1";"780";"1";"212913106619453";"data";"data.*";"fetched (200)";"2023-10-01 11:32:02.249530";"Facebook:/<post-id>/comments";"";"Gracias a ti, puedo conciliar sueño nuevamente :')"
"1";"781";"1";"212913106619453";"offcut";"";"fetched (200)";"2023-10-01 11:32:02.249530";"Facebook:/<post-id>/comments";"";""
"1";"782";"1";"212913106619453";"data";"data.*";"fetched (200)";"2023-10-01 11:32:02.569239";"Facebook:/<post-id>/comments";"";"Llege aqui por recomendación de mi doctor.. Me. Dijo ve sus videos y te dormiras.. Gracias.. Ni las pastillas 😁😁"
"1";"783";"1";"212913106619453";"data";"data.*";"fetched (200)";"2023-10-01 11:32:02.569239";"Facebook:/<post-id>/comments";"";"Un video recopilatorio con todos los memes de la red, contados hasta el qlo"
"1";"784";"1";"212913106619453";"data";"data.*";"fetched (200)";"2023-10-01 11:32:02.569239";"Facebook:/<post-id>/comments";"";"Que siga hablando el Coronavirus se esta quedando dormido"
"1";"785";"1";"212913106619453";"data";"data.*";"fetched (200)";"2023-10-01 11:32:02.569239";"Facebook:/<post-id>/comments";"";"y yo que me había puesto windows defender csmr, por la hueva 🤦‍♂️"
"1";"786";"1";"212913106619453";"data";"data.*";"fetched (200)";"2023-10-01 11:32:02.569239";"Facebook:/<post-id>/comments";"";"Que fácil ser youtuber. Lees todos los memes y luego haces un video"
"1";"787";"1";"212913106619453";"data";"data.*";"fetched (200)";"2023-10-01 11:32:02.569239";"Facebook:/<post-id>/comments";"";"bien Mateo , eres un crack, informando de manera divertida."
"1";"788";"1";"212913106619453";"data";"data.*";"fetched (200)";"2023-10-01 11:32:02.569239";"Facebook:/<post-id>/comments";"";"Justo tenia sueño, no puedo dormir hace diaZzZzZzzzzzzzZzzzzz"
"1";"789";"1";"212913106619453";"data";"data.*";"fetched (200)";"2023-10-01 11:32:02.569239";"Facebook:/<post-id>/comments";"";"🤣🤣🤣🤣 Pues no se pq tanto lo critican el chico tiene talento. Me hizo reír, buena Mateo 👍"
"1";"790";"1";"212913106619453";"data";"data.*";"fetched (200)";"2023-10-01 11:32:02.569239";"Facebook:/<post-id>/comments";"";"Se rompió mi caja de risa..."
"1";"791";"1";"212913106619453";"data";"data.*";"fetched (200)";"2023-10-01 11:32:02.569239";"Facebook:/<post-id>/comments";"";"Y uno con un sueño de mierrrrrr gracias por reforzarlo :'v....zzzzzzzz"
"1";"792";"1";"212913106619453";"data";"data.*";"fetched (200)";"2023-10-01 11:32:02.569239";"Facebook:/<post-id>/comments";"";"A qué hora viene el chiste que mencionas en tu comentario?🤔"
"1";"793";"1";"212913106619453";"data";"data.*";"fetched (200)";"2023-10-01 11:32:02.569239";"Facebook:/<post-id>/comments";"";"Por poner este video dejaste en coma a mi perro"
"1";"794";"1";"212913106619453";"data";"data.*";"fetched (200)";"2023-10-01 11:32:02.569239";"Facebook:/<post-id>/comments";"";"Ya no entiendo cual es el chiste si el video de este weon o los comentarios :V "
"1";"795";"1";"212913106619453";"data";"data.*";"fetched (200)";"2023-10-01 11:32:02.569239";"Facebook:/<post-id>/comments";"";"Puros chistes de memes no más sacas mano y ni así llegas a causar gracia, así que es hora de darle play al video y zzzzzzz....."
"1";"796";"1";"212913106619453";"data";"data.*";"fetched (200)";"2023-10-01 11:32:02.569239";"Facebook:/<post-id>/comments";"";"No dan risa tus vid... Zzz"
"1";"797";"1";"212913106619453";"data";"data.*";"fetched (200)";"2023-10-01 11:32:02.569239";"Facebook:/<post-id>/comments";"";"Por las puras es, el humor no es lo tuyo :( ojalá no sea parte de pataclaun."
"1";"798";"1";"212913106619453";"data";"data.*";"fetched (200)";"2023-10-01 11:32:02.569239";"Facebook:/<post-id>/comments";"";"tu vas a matar el coronavirus de sueño"
"1";"799";"1";"212913106619453";"data";"data.*";"fetched (200)";"2023-10-01 11:32:02.569239";"Facebook:/<post-id>/comments";"";"Jajaja me gustó el : "" Mas carilla"" , buena buena zzzzzzzzzzzzzz"
"1";"800";"1";"212913106619453";"data";"data.*";"fetched (200)";"2023-10-01 11:32:02.569239";"Facebook:/<post-id>/comments";"";"Buena. Fue mejorando al final. Stas recuperando el toque papu. Bien ahi"
"1";"801";"1";"212913106619453";"data";"data.*";"fetched (200)";"2023-10-01 11:32:02.569239";"Facebook:/<post-id>/comments";"";"Sobrevivimos a la Revolución de Maritza"
"1";"802";"1";"212913106619453";"data";"data.*";"fetched (200)";"2023-10-01 11:32:02.569239";"Facebook:/<post-id>/comments";"";"En que clínica están tratando esos síntomas? ☝️"
"1";"803";"1";"212913106619453";"data";"data.*";"fetched (200)";"2023-10-01 11:32:02.569239";"Facebook:/<post-id>/comments";"";"Eres tan divertido como una tortuga caminando."
"1";"804";"1";"212913106619453";"data";"data.*";"fetched (200)";"2023-10-01 11:32:02.569239";"Facebook:/<post-id>/comments";"";"Yo pase de frente a comentarios para reirme de verdad "
"1";"805";"1";"212913106619453";"data";"data.*";"fetched (200)";"2023-10-01 11:32:02.569239";"Facebook:/<post-id>/comments";"";"Me hizo olvidar la preucupacion eres genial 😘😘😘"
"1";"806";"1";"212913106619453";"data";"data.*";"fetched (200)";"2023-10-01 11:32:02.569239";"Facebook:/<post-id>/comments";"";"Ta que sus chistes son puros memes ninguna picardía tuya"
"1";"807";"1";"212913106619453";"offcut";"";"fetched (200)";"2023-10-01 11:32:02.569239";"Facebook:/<post-id>/comments";"";""
"1";"808";"1";"212913106619453";"data";"data.*";"fetched (200)";"2023-10-01 11:32:02.935467";"Facebook:/<post-id>/comments";"";"Yo tenía entradas para tu show y no fui ptmr 🤦🥺😭"
"1";"809";"1";"212913106619453";"data";"data.*";"fetched (200)";"2023-10-01 11:32:02.935467";"Facebook:/<post-id>/comments";"";"Comediante de pitucas"
"1";"810";"1";"212913106619453";"data";"data.*";"fetched (200)";"2023-10-01 11:32:02.935467";"Facebook:/<post-id>/comments";"";"Nada con tu video el coranovirus ya se durmió zzzz."
"1";"811";"1";"212913106619453";"data";"data.*";"fetched (200)";"2023-10-01 11:32:02.935467";"Facebook:/<post-id>/comments";"";"admito que si me rei un poco"
"1";"812";"1";"212913106619453";"data";"data.*";"fetched (200)";"2023-10-01 11:32:02.935467";"Facebook:/<post-id>/comments";"";"A la firme yo me cage de risa con ese video,  los que digan que no que le dé el coronavirus"
"1";"813";"1";"212913106619453";"data";"data.*";"fetched (200)";"2023-10-01 11:32:02.935467";"Facebook:/<post-id>/comments";"";"""esto es Perú o Venezuela"" 😂😂😂😂😂"
"1";"814";"1";"212913106619453";"data";"data.*";"fetched (200)";"2023-10-01 11:32:02.935467";"Facebook:/<post-id>/comments";"";"Ajajajaja por fin te hiciste una!!!!! Tuvo que pasar esto del coronavirus para que hagas reír.......🤣🤣🤣"
"1";"815";"1";"212913106619453";"data";"data.*";"fetched (200)";"2023-10-01 11:32:02.935467";"Facebook:/<post-id>/comments";"";"A mi me dio risa, estuvo bueno 👏🤙"
"1";"816";"1";"212913106619453";"data";"data.*";"fetched (200)";"2023-10-01 11:32:02.935467";"Facebook:/<post-id>/comments";"";"Sheyla Humerez para que te rías por lo coja "
"1";"817";"1";"212913106619453";"data";"data.*";"fetched (200)";"2023-10-01 11:32:02.935467";"Facebook:/<post-id>/comments";"";"Bro no es por ser mala onda, pero enserio no das risa, no tienes humor ademjdjdjdjdjdj zzzzzzzzzzzzzzzzzz"
"1";"818";"1";"212913106619453";"data";"data.*";"fetched (200)";"2023-10-01 11:32:02.935467";"Facebook:/<post-id>/comments";"";"Te crees chistoso  También sobrevivimos a tu familia terruca."
"1";"819";"1";"212913106619453";"data";"data.*";"fetched (200)";"2023-10-01 11:32:02.935467";"Facebook:/<post-id>/comments";"";"Todos preparados y comienza la cuenta 1...2...3 😴😴😴😴😴😴😴😴😴😴😴😴😴😴😴"
"1";"820";"1";"212913106619453";"data";"data.*";"fetched (200)";"2023-10-01 11:32:02.935467";"Facebook:/<post-id>/comments";"";"No soy de alianza pero como que ni es normal que casi me duerma. Estaria bacan que le hagas comercial a Vic Z"
"1";"821";"1";"212913106619453";"data";"data.*";"fetched (200)";"2023-10-01 11:32:02.935467";"Facebook:/<post-id>/comments";"";"Ósea todos los pobres del Perú"
"1";"822";"1";"212913106619453";"data";"data.*";"fetched (200)";"2023-10-01 11:32:02.935467";"Facebook:/<post-id>/comments";"";"Vi y me dio ganas de cgr 💩"
"1";"823";"1";"212913106619453";"data";"data.*";"fetched (200)";"2023-10-01 11:32:02.935467";"Facebook:/<post-id>/comments";"";"Gracias, dormí poco hoy, pero por ti volveré a dormír con ganas "
"1";"824";"1";"212913106619453";"data";"data.*";"fetched (200)";"2023-10-01 11:32:02.935467";"Facebook:/<post-id>/comments";"";"No das risa, cuándo vas a entender?"
"1";"825";"1";"212913106619453";"data";"data.*";"fetched (200)";"2023-10-01 11:32:02.935467";"Facebook:/<post-id>/comments";"";"no compre tantas mascarillas que ahora van a estar mas carillas .. xdd 😂😂😂"
"1";"826";"1";"212913106619453";"data";"data.*";"fetched (200)";"2023-10-01 11:32:02.935467";"Facebook:/<post-id>/comments";"";"OJALÁ QUE CON TUS CHISTES DESAPAREZCA EL VIRUS!!"
"1";"827";"1";"212913106619453";"data";"data.*";"fetched (200)";"2023-10-01 11:32:02.935467";"Facebook:/<post-id>/comments";"";"Todo iba bien hasta que te burlaste de Alianza 😭🤨"
"1";"828";"1";"212913106619453";"data";"data.*";"fetched (200)";"2023-10-01 11:32:02.935467";"Facebook:/<post-id>/comments";"";"A mí sí me dió risa."
"1";"829";"1";"212913106619453";"data";"data.*";"fetched (200)";"2023-10-01 11:32:02.935467";"Facebook:/<post-id>/comments";"";"Al ver su cara ya me dio suezzzzzzzzzz"
"1";"830";"1";"212913106619453";"data";"data.*";"fetched (200)";"2023-10-01 11:32:02.935467";"Facebook:/<post-id>/comments";"";"El único video que me dio risa 😂"
"1";"831";"1";"212913106619453";"data";"data.*";"fetched (200)";"2023-10-01 11:32:02.935467";"Facebook:/<post-id>/comments";"";"Me rei! Como muchos,  no como otros sin criterio propio y llenos de paradigmas.  Buena Mateo!"
"1";"832";"1";"212913106619453";"data";"data.*";"fetched (200)";"2023-10-01 11:32:02.935467";"Facebook:/<post-id>/comments";"";"seguro ya lo dormiste al coronavirus!!! =( =( "
"1";"833";"1";"212913106619453";"offcut";"";"fetched (200)";"2023-10-01 11:32:02.935467";"Facebook:/<post-id>/comments";"";""
"1";"834";"1";"212913106619453";"data";"data.*";"fetched (200)";"2023-10-01 11:32:03.328088";"Facebook:/<post-id>/comments";"";"Bien Mathias, para no verte como siempre.😬"
"1";"835";"1";"212913106619453";"data";"data.*";"fetched (200)";"2023-10-01 11:32:03.328088";"Facebook:/<post-id>/comments";"";"Primera vez me dio risa, esta mejorando jajajajajajajajajajajaja"
"1";"836";"1";"212913106619453";"data";"data.*";"fetched (200)";"2023-10-01 11:32:03.328088";"Facebook:/<post-id>/comments";"";"Gracias mano ahora si voy a zzzZzzZzzZzzZzzz"
"1";"837";"1";"212913106619453";"data";"data.*";"fetched (200)";"2023-10-01 11:32:03.328088";"Facebook:/<post-id>/comments";"";"El final es lo unici que da risa monstruo ctmr jajajaa"
"1";"838";"1";"212913106619453";"data";"data.*";"fetched (200)";"2023-10-01 11:32:03.328088";"Facebook:/<post-id>/comments";"";"Gracias Mateo  necesitaba algo para dormir zzzzzzzzzzzzzz"
"1";"839";"1";"212913106619453";"data";"data.*";"fetched (200)";"2023-10-01 11:32:03.328088";"Facebook:/<post-id>/comments";"";"O si eres de Alianza Lima.. jajajajaja si tiene su gracia el pata.."
"1";"840";"1";"212913106619453";"data";"data.*";"fetched (200)";"2023-10-01 11:32:03.328088";"Facebook:/<post-id>/comments";"";"Pero hijo sabes que la gente te va a joder y tu dale  🤣🤣🤣🤣"
"1";"841";"1";"212913106619453";"data";"data.*";"fetched (200)";"2023-10-01 11:32:03.328088";"Facebook:/<post-id>/comments";"";"Este video si estuvo cvr."
"1";"842";"1";"212913106619453";"data";"data.*";"fetched (200)";"2023-10-01 11:32:03.328088";"Facebook:/<post-id>/comments";"";"Este video si me dio risa... De los pocos que vi una cagada, este si está bueno.  "
"1";"843";"1";"212913106619453";"data";"data.*";"fetched (200)";"2023-10-01 11:32:03.328088";"Facebook:/<post-id>/comments";"";"Ver tu vídeo m dio gripe xD"
"1";"844";"1";"212913106619453";"data";"data.*";"fetched (200)";"2023-10-01 11:32:03.328088";"Facebook:/<post-id>/comments";"";"Como que de Alianza todo estaba bien hasta que mensionaste al equipo de mis amores 😤"
"1";"845";"1";"212913106619453";"data";"data.*";"fetched (200)";"2023-10-01 11:32:03.328088";"Facebook:/<post-id>/comments";"";"La 1ra vez q algo q haces me da risa"
"1";"846";"1";"212913106619453";"data";"data.*";"fetched (200)";"2023-10-01 11:32:03.328088";"Facebook:/<post-id>/comments";"";"Este es el que da risa y pena o solo pena?"
"1";"847";"1";"212913106619453";"data";"data.*";"fetched (200)";"2023-10-01 11:32:03.328088";"Facebook:/<post-id>/comments";"";"Por qué no infectas del coronavirus y haces tus chistes"
"1";"848";"1";"212913106619453";"data";"data.*";"fetched (200)";"2023-10-01 11:32:03.328088";"Facebook:/<post-id>/comments";"";"Se me fue el insomnio. Gracias Monse zzzzzz...."
"1";"849";"1";"212913106619453";"data";"data.*";"fetched (200)";"2023-10-01 11:32:03.328088";"Facebook:/<post-id>/comments";"";"reciclaje de memes de internet"
"1";"850";"1";"212913106619453";"data";"data.*";"fetched (200)";"2023-10-01 11:32:03.328088";"Facebook:/<post-id>/comments";"";"Maldetoo como te burlas de mi Alianza 💙🤭🤭"
"1";"851";"1";"212913106619453";"data";"data.*";"fetched (200)";"2023-10-01 11:32:03.328088";"Facebook:/<post-id>/comments";"";"Jajaja buen video! Nochagas caso a los comentarios malosos. Sigue adelante tio :)"
"1";"852";"1";"212913106619453";"data";"data.*";"fetched (200)";"2023-10-01 11:32:03.328088";"Facebook:/<post-id>/comments";"";"Me habia olvidado sacar el like de la pagina saluw"
"1";"853";"1";"212913106619453";"data";"data.*";"fetched (200)";"2023-10-01 11:32:03.328088";"Facebook:/<post-id>/comments";"";"AnaClau Clau Clau tiene razón el coronavirus está por convertirse en influencer 😅"
"1";"854";"1";"212913106619453";"data";"data.*";"fetched (200)";"2023-10-01 11:32:03.328088";"Facebook:/<post-id>/comments";"";"Dan mas risa los comentarios de la gente que tu jajajaja"
"1";"855";"1";"212913106619453";"data";"data.*";"fetched (200)";"2023-10-01 11:32:03.328088";"Facebook:/<post-id>/comments";"";"Cuando mateo sube videos corro...pero a los comentarios para reirme XD"
"1";"856";"1";"212913106619453";"data";"data.*";"fetched (200)";"2023-10-01 11:32:03.328088";"Facebook:/<post-id>/comments";"";"Quien es la flaca ?"
"1";"857";"1";"212913106619453";"data";"data.*";"fetched (200)";"2023-10-01 11:32:03.328088";"Facebook:/<post-id>/comments";"";"Me gustoooo😊 me hizo reir😂 buen video👏🏻"
"1";"858";"1";"212913106619453";"data";"data.*";"fetched (200)";"2023-10-01 11:32:03.328088";"Facebook:/<post-id>/comments";"";"Buen vídeo :'v"
"1";"859";"1";"212913106619453";"offcut";"";"fetched (200)";"2023-10-01 11:32:03.328088";"Facebook:/<post-id>/comments";"";""
"1";"860";"1";"212913106619453";"data";"data.*";"fetched (200)";"2023-10-01 11:32:03.717774";"Facebook:/<post-id>/comments";"";"Primera vez q me da risa este csm 🤣🤣😲😲"
"1";"861";"1";"212913106619453";"data";"data.*";"fetched (200)";"2023-10-01 11:32:03.717774";"Facebook:/<post-id>/comments";"";"Jajajajajajja la muerte jajajjaja"
"1";"862";"1";"212913106619453";"data";"data.*";"fetched (200)";"2023-10-01 11:32:03.717774";"Facebook:/<post-id>/comments";"";"Aburres hablando men Dedícate a otra cosa  Porque aburres en serio Y peor que eres hincha de la O"
"1";"863";"1";"212913106619453";"data";"data.*";"fetched (200)";"2023-10-01 11:32:03.717774";"Facebook:/<post-id>/comments";"";"Mas Alla del chiste ? Cual chiste :v?"
"1";"864";"1";"212913106619453";"data";"data.*";"fetched (200)";"2023-10-01 11:32:03.717774";"Facebook:/<post-id>/comments";"";"Solo me dio risa la parte de MOSTRO DE MIERDA jaja 🤣🤣🤣"
"1";"865";"1";"212913106619453";"data";"data.*";"fetched (200)";"2023-10-01 11:32:03.717774";"Facebook:/<post-id>/comments";"";"MaríaPía Bernaola Guerrero tienes que verlo! Influencer, canje, amigos de latam ajajjajaja miraloo"
"1";"866";"1";"212913106619453";"data";"data.*";"fetched (200)";"2023-10-01 11:32:03.717774";"Facebook:/<post-id>/comments";"";"Justo quería dormir como bebitzzzzzzz"
"1";"867";"1";"212913106619453";"data";"data.*";"fetched (200)";"2023-10-01 11:32:03.717774";"Facebook:/<post-id>/comments";"";"Un like para la flaca del video."
"1";"868";"1";"212913106619453";"data";"data.*";"fetched (200)";"2023-10-01 11:32:03.717774";"Facebook:/<post-id>/comments";"";"Mejor sigue chancando a tu primo eso me mataría de la risa xd"
"1";"869";"1";"212913106619453";"data";"data.*";"fetched (200)";"2023-10-01 11:32:03.717774";"Facebook:/<post-id>/comments";"";"Ok me aguante de decirte todo esto Nessa Burga 😂😂 más clarito q el agua 😂😂"
"1";"870";"1";"212913106619453";"data";"data.*";"fetched (200)";"2023-10-01 11:32:03.717774";"Facebook:/<post-id>/comments";"";"Esta vez dio risa, tas mejorando Mateo"
"1";"871";"1";"212913106619453";"data";"data.*";"fetched (200)";"2023-10-01 11:32:03.717774";"Facebook:/<post-id>/comments";"";"Hay apoyo falta talento 🤷🏻‍♂️"
"1";"872";"1";"212913106619453";"data";"data.*";"fetched (200)";"2023-10-01 11:32:03.717774";"Facebook:/<post-id>/comments";"";"Zzzzz,,"
"1";"873";"1";"212913106619453";"data";"data.*";"fetched (200)";"2023-10-01 11:32:03.717774";"Facebook:/<post-id>/comments";"";"La última parte lo fue todo Mostró de mrd...."
"1";"874";"1";"212913106619453";"data";"data.*";"fetched (200)";"2023-10-01 11:32:03.717774";"Facebook:/<post-id>/comments";"";"Mila Maldonado mira "
"1";"875";"1";"212913106619453";"data";"data.*";"fetched (200)";"2023-10-01 11:32:03.717774";"Facebook:/<post-id>/comments";"";"Video para el insomnio"
"1";"876";"1";"212913106619453";"data";"data.*";"fetched (200)";"2023-10-01 11:32:03.717774";"Facebook:/<post-id>/comments";"";"Mas carillas xddd"
"1";"877";"1";"212913106619453";"data";"data.*";"fetched (200)";"2023-10-01 11:32:03.717774";"Facebook:/<post-id>/comments";"";"Jajajaja Perú o Venezuela jajajajaja xD"
"1";"878";"1";"212913106619453";"data";"data.*";"fetched (200)";"2023-10-01 11:32:03.717774";"Facebook:/<post-id>/comments";"";"por qe me sale estas webada aparte da sueño"
"1";"879";"1";"212913106619453";"data";"data.*";"fetched (200)";"2023-10-01 11:32:03.717774";"Facebook:/<post-id>/comments";"";"Jajajjajaja, parece un Tambo. 🤣"
"1";"880";"1";"212913106619453";"data";"data.*";"fetched (200)";"2023-10-01 11:32:03.717774";"Facebook:/<post-id>/comments";"";"Esa la de mas-carillas, terrible barra que te mandaste"
"1";"881";"1";"212913106619453";"data";"data.*";"fetched (200)";"2023-10-01 11:32:03.717774";"Facebook:/<post-id>/comments";"";"Antonella Espichan... lo amo... Jajajajajajaja "
"1";"882";"1";"212913106619453";"data";"data.*";"fetched (200)";"2023-10-01 11:32:03.717774";"Facebook:/<post-id>/comments";"";"Me hizo reír de algo muy serio🙄😆"
"1";"883";"1";"212913106619453";"data";"data.*";"fetched (200)";"2023-10-01 11:32:03.717774";"Facebook:/<post-id>/comments";"";"Segundo 50. Barras barras"
"1";"884";"1";"212913106619453";"data";"data.*";"fetched (200)";"2023-10-01 11:32:03.717774";"Facebook:/<post-id>/comments";"";"Que lápiz es e este man"
"1";"885";"1";"212913106619453";"offcut";"";"fetched (200)";"2023-10-01 11:32:03.717774";"Facebook:/<post-id>/comments";"";""
"1";"886";"1";"212913106619453";"data";"data.*";"fetched (200)";"2023-10-01 11:32:04.052485";"Facebook:/<post-id>/comments";"";"Oh, que gracioso eres on' 😐"
"1";"887";"1";"212913106619453";"data";"data.*";"fetched (200)";"2023-10-01 11:32:04.052485";"Facebook:/<post-id>/comments";"";"Que haga su reto influencer que se contagie de coronaviruzzzzz......zzzzz...."
